id,user_id,post_type,content,recipient_id,created_at,is_visible
746,408,Story,sapien varius ut blandit non interdum in ante vestibulum ante,304,2023-03-20T04:55:04Z,1
747,384,Message,rutrum rutrum neque aenean auctor gravida sem praesent id massa id nisl venenatis lacinia aenean,650,2023-11-09T10:39:13Z,1
748,715,Message,quam fringilla rhoncus mauris enim leo rhoncus sed vestibulum sit amet cursus id turpis integer aliquet massa,478,2023-08-18T02:57:53Z,1
749,834,Message,erat volutpat in congue etiam justo etiam pretium iaculis justo in hac habitasse platea,81,2023-08-30T09:01:34Z,1
750,562,Message,pede justo eu massa donec dapibus duis at velit eu est congue elementum in,382,2023-11-10T14:02:56Z,1
751,175,Story,nulla ultrices aliquet maecenas leo odio condimentum id luctus nec molestie sed justo pellentesque viverra pede ac,562,2023-06-01T10:16:12Z,1
752,920,Message,non velit nec nisi vulputate nonummy maecenas tincidunt lacus at velit vivamus vel nulla,243,2024-01-02T15:04:14Z,1
753,205,Message,fusce consequat nulla nisl nunc nisl duis bibendum felis sed interdum,859,2023-09-01T01:54:09Z,1
754,316,Story,ligula pellentesque ultrices phasellus id sapien in sapien iaculis congue vivamus metus arcu adipiscing molestie,316,2024-02-08T03:58:39Z,1
755,906,Story,in quam fringilla rhoncus mauris enim leo rhoncus sed vestibulum sit amet cursus,256,2023-09-02T03:21:28Z,1
756,230,Message,erat eros viverra eget congue eget semper rutrum nulla nunc purus phasellus in felis donec semper sapien a,182,2024-02-18T09:02:27Z,1
757,694,Story,congue vivamus metus arcu adipiscing molestie hendrerit at vulputate vitae nisl aenean lectus pellentesque eget,393,2023-12-21T07:12:23Z,1
758,849,Story,praesent blandit nam nulla integer pede justo lacinia eget tincidunt eget tempus vel pede morbi porttitor lorem id ligula,143,2023-12-28T18:52:09Z,1
759,118,Message,dolor sit amet consectetuer adipiscing elit proin interdum mauris non,955,2023-02-26T16:18:29Z,1
760,174,Story,dignissim vestibulum vestibulum ante ipsum primis in faucibus orci luctus et ultrices posuere cubilia curae nulla dapibus dolor vel est,986,2023-04-07T09:48:42Z,1
761,117,Story,auctor gravida sem praesent id massa id nisl venenatis lacinia aenean sit amet,673,2023-03-18T09:56:37Z,1
762,920,Message,vulputate luctus cum sociis natoque penatibus et magnis dis parturient,582,2023-03-03T02:12:09Z,1
763,119,Story,lectus pellentesque at nulla suspendisse potenti cras in purus eu magna vulputate luctus cum sociis natoque penatibus et magnis,354,2023-11-16T19:09:53Z,1
764,575,Message,integer ac neque duis bibendum morbi non quam nec dui luctus,229,2023-08-24T11:07:34Z,1
765,479,Message,in faucibus orci luctus et ultrices posuere cubilia curae mauris viverra diam vitae quam suspendisse potenti nullam,785,2023-06-21T09:18:06Z,1
766,275,Message,sapien arcu sed augue aliquam erat volutpat in congue etiam justo etiam pretium,360,2024-01-08T15:46:10Z,1
767,164,Story,natoque penatibus et magnis dis parturient montes nascetur ridiculus mus,570,2023-08-26T17:43:23Z,1
768,129,Message,auctor sed tristique in tempus sit amet sem fusce consequat nulla nisl nunc nisl duis,932,2023-06-18T00:37:49Z,1
769,911,Story,faucibus orci luctus et ultrices posuere cubilia curae donec pharetra magna vestibulum aliquet ultrices,556,2023-10-10T01:42:02Z,1
770,501,Story,mi nulla ac enim in tempor turpis nec euismod scelerisque quam turpis adipiscing lorem vitae mattis nibh ligula nec sem,395,2023-09-26T15:21:22Z,1
771,518,Message,erat nulla tempus vivamus in felis eu sapien cursus vestibulum proin eu,837,2024-02-16T13:53:25Z,1
772,69,Message,rhoncus aliquet pulvinar sed nisl nunc rhoncus dui vel sem sed sagittis nam,198,2023-03-05T16:42:45Z,1
773,479,Story,pede justo lacinia eget tincidunt eget tempus vel pede morbi porttitor lorem id ligula suspendisse ornare,209,2023-04-02T20:01:27Z,1
774,953,Story,in blandit ultrices enim lorem ipsum dolor sit amet consectetuer adipiscing elit proin,461,2023-02-27T16:39:07Z,1
775,343,Message,sem fusce consequat nulla nisl nunc nisl duis bibendum felis sed interdum venenatis turpis enim blandit,753,2023-09-17T20:07:20Z,1
776,70,Story,pretium nisl ut volutpat sapien arcu sed augue aliquam erat volutpat in congue etiam justo,520,2023-09-12T08:55:49Z,1
777,730,Message,augue luctus tincidunt nulla mollis molestie lorem quisque ut erat curabitur gravida nisi at nibh in hac habitasse,841,2023-09-10T14:14:51Z,1
778,628,Message,suspendisse accumsan tortor quis turpis sed ante vivamus tortor duis mattis egestas metus aenean fermentum donec ut,145,2023-10-31T19:57:03Z,1
779,843,Message,cras in purus eu magna vulputate luctus cum sociis natoque penatibus et magnis dis parturient montes nascetur ridiculus mus vivamus,265,2024-02-02T15:33:03Z,1
780,780,Story,felis eu sapien cursus vestibulum proin eu mi nulla ac enim in tempor turpis nec euismod scelerisque quam,360,2023-05-05T23:21:02Z,1
781,632,Story,integer a nibh in quis justo maecenas rhoncus aliquam lacus morbi quis tortor id,868,2023-07-21T04:19:59Z,1
782,627,Story,quisque ut erat curabitur gravida nisi at nibh in hac habitasse platea dictumst aliquam augue,566,2023-07-04T14:00:42Z,1
783,823,Message,curabitur convallis duis consequat dui nec nisi volutpat eleifend donec ut dolor morbi vel lectus in quam,48,2023-09-23T08:36:08Z,1
784,870,Message,at turpis donec posuere metus vitae ipsum aliquam non mauris morbi,741,2023-08-05T16:43:16Z,1
785,876,Story,magnis dis parturient montes nascetur ridiculus mus etiam vel augue vestibulum rutrum rutrum neque aenean auctor gravida sem praesent,900,2023-08-29T12:43:10Z,1
786,987,Story,sollicitudin ut suscipit a feugiat et eros vestibulum ac est lacinia nisi venenatis tristique,790,2023-10-28T18:03:13Z,1
787,520,Story,orci nullam molestie nibh in lectus pellentesque at nulla suspendisse potenti cras in purus eu magna,746,2023-02-23T07:11:31Z,1
788,215,Story,nibh ligula nec sem duis aliquam convallis nunc proin at turpis a,495,2023-08-22T15:53:47Z,1
789,59,Story,id massa id nisl venenatis lacinia aenean sit amet justo morbi ut,868,2023-05-27T05:31:58Z,1
790,807,Story,sed tristique in tempus sit amet sem fusce consequat nulla nisl nunc nisl duis bibendum felis sed,209,2024-01-03T10:00:40Z,1
791,490,Story,amet sapien dignissim vestibulum vestibulum ante ipsum primis in faucibus,890,2023-11-02T22:33:56Z,1
792,883,Story,in quam fringilla rhoncus mauris enim leo rhoncus sed vestibulum sit amet cursus id turpis integer aliquet massa id,946,2023-06-02T06:45:45Z,1
793,915,Story,convallis tortor risus dapibus augue vel accumsan tellus nisi eu orci mauris lacinia sapien quis,955,2023-12-24T18:57:56Z,1
794,945,Message,cum sociis natoque penatibus et magnis dis parturient montes nascetur ridiculus mus vivamus vestibulum sagittis sapien cum,801,2024-01-12T01:39:56Z,1
795,658,Message,at nulla suspendisse potenti cras in purus eu magna vulputate luctus cum sociis natoque penatibus et magnis,139,2023-04-07T14:42:49Z,1
796,698,Message,justo pellentesque viverra pede ac diam cras pellentesque volutpat dui maecenas tristique est et tempus semper,778,2023-12-02T12:15:41Z,1
797,394,Story,lacus morbi sem mauris laoreet ut rhoncus aliquet pulvinar sed nisl nunc rhoncus dui vel sem sed sagittis,166,2023-09-03T01:57:38Z,1
798,814,Story,quisque id justo sit amet sapien dignissim vestibulum vestibulum ante ipsum primis in faucibus,887,2023-05-17T13:35:43Z,1
799,477,Story,ipsum primis in faucibus orci luctus et ultrices posuere cubilia,853,2023-04-06T03:46:07Z,1
800,259,Story,auctor sed tristique in tempus sit amet sem fusce consequat nulla nisl nunc nisl duis bibendum felis,437,2023-06-29T06:55:06Z,1
801,748,Message,placerat praesent blandit nam nulla integer pede justo lacinia eget tincidunt eget tempus vel pede,631,2023-03-23T12:03:41Z,1
802,223,Message,sed tristique in tempus sit amet sem fusce consequat nulla nisl nunc nisl duis bibendum felis sed,476,2023-12-07T06:56:25Z,1
803,902,Story,sed lacus morbi sem mauris laoreet ut rhoncus aliquet pulvinar sed nisl nunc rhoncus,458,2023-03-24T09:25:50Z,1
804,582,Message,ultrices erat tortor sollicitudin mi sit amet lobortis sapien sapien non mi integer,911,2024-01-23T08:55:50Z,1
805,994,Message,auctor gravida sem praesent id massa id nisl venenatis lacinia aenean sit amet justo morbi ut,141,2023-10-10T02:21:56Z,1
806,167,Message,ipsum integer a nibh in quis justo maecenas rhoncus aliquam lacus,805,2024-01-16T06:49:31Z,1
807,668,Message,ultrices erat tortor sollicitudin mi sit amet lobortis sapien sapien non mi,787,2023-04-11T15:19:46Z,1
808,300,Message,ante vivamus tortor duis mattis egestas metus aenean fermentum donec ut mauris eget massa,101,2023-12-19T05:31:29Z,1
809,182,Story,aliquam erat volutpat in congue etiam justo etiam pretium iaculis justo in hac habitasse,127,2023-09-25T00:23:51Z,1
810,108,Message,lectus vestibulum quam sapien varius ut blandit non interdum in ante vestibulum ante ipsum primis in faucibus orci luctus et,937,2023-06-16T17:14:19Z,1
811,557,Story,nunc proin at turpis a pede posuere nonummy integer non velit donec diam neque vestibulum eget vulputate,286,2023-10-11T11:02:13Z,1
812,153,Message,sagittis dui vel nisl duis ac nibh fusce lacus purus aliquet,814,2023-12-31T07:30:15Z,1
813,956,Story,maecenas tincidunt lacus at velit vivamus vel nulla eget eros elementum pellentesque quisque porta volutpat,196,2023-12-22T22:50:29Z,1
814,987,Message,sed tincidunt eu felis fusce posuere felis sed lacus morbi sem mauris laoreet ut,755,2023-09-06T22:01:21Z,1
815,863,Message,viverra dapibus nulla suscipit ligula in lacus curabitur at ipsum ac tellus semper interdum mauris ullamcorper purus,44,2023-11-11T01:18:44Z,1
816,749,Story,facilisi cras non velit nec nisi vulputate nonummy maecenas tincidunt lacus at velit,924,2023-11-07T05:34:36Z,1
817,610,Story,at vulputate vitae nisl aenean lectus pellentesque eget nunc donec quis orci eget orci vehicula condimentum curabitur in libero ut,947,2023-10-12T06:01:04Z,1
818,821,Message,ante vel ipsum praesent blandit lacinia erat vestibulum sed magna at nunc commodo placerat,989,2023-11-03T00:47:12Z,1
819,555,Story,tincidunt lacus at velit vivamus vel nulla eget eros elementum pellentesque quisque porta volutpat,989,2024-01-06T11:01:37Z,1
820,537,Story,vel augue vestibulum ante ipsum primis in faucibus orci luctus et ultrices posuere,321,2024-02-23T21:09:52Z,1
821,832,Message,nunc vestibulum ante ipsum primis in faucibus orci luctus et ultrices posuere cubilia curae mauris,309,2023-04-20T21:52:41Z,1
822,666,Story,eget semper rutrum nulla nunc purus phasellus in felis donec semper sapien a libero nam dui proin leo odio porttitor,381,2023-03-17T11:31:42Z,1
823,467,Story,sapien dignissim vestibulum vestibulum ante ipsum primis in faucibus orci luctus et ultrices,965,2023-06-11T08:59:57Z,1
824,175,Story,posuere metus vitae ipsum aliquam non mauris morbi non lectus aliquam sit amet diam in magna bibendum,910,2023-10-07T21:53:06Z,1
825,142,Story,vestibulum rutrum rutrum neque aenean auctor gravida sem praesent id massa id nisl venenatis lacinia aenean sit amet,530,2023-10-08T17:17:58Z,1
826,815,Story,porttitor id consequat in consequat ut nulla sed accumsan felis ut at dolor quis odio,823,2023-11-29T22:45:13Z,1
827,828,Story,id consequat in consequat ut nulla sed accumsan felis ut at,837,2023-08-10T06:27:49Z,1
828,80,Story,cursus id turpis integer aliquet massa id lobortis convallis tortor risus dapibus augue vel accumsan tellus nisi eu orci mauris,683,2023-03-20T16:19:44Z,1
829,302,Story,ultrices erat tortor sollicitudin mi sit amet lobortis sapien sapien non mi integer ac neque duis bibendum morbi non quam,297,2023-03-09T22:56:06Z,1
830,533,Story,metus aenean fermentum donec ut mauris eget massa tempor convallis nulla neque,263,2023-07-05T22:37:07Z,1
831,416,Story,vitae quam suspendisse potenti nullam porttitor lacus at turpis donec posuere,390,2023-05-02T00:34:05Z,1
832,768,Message,quis tortor id nulla ultrices aliquet maecenas leo odio condimentum id luctus nec molestie sed justo pellentesque viverra,567,2023-05-31T07:20:16Z,1
833,615,Message,non ligula pellentesque ultrices phasellus id sapien in sapien iaculis,9,2023-04-06T23:28:13Z,1
834,459,Message,tristique fusce congue diam id ornare imperdiet sapien urna pretium,566,2023-10-17T10:40:18Z,1
835,108,Message,quis turpis eget elit sodales scelerisque mauris sit amet eros suspendisse accumsan tortor quis turpis sed ante vivamus tortor duis,777,2023-06-16T03:36:32Z,1
836,956,Message,aenean lectus pellentesque eget nunc donec quis orci eget orci vehicula condimentum curabitur in libero ut massa volutpat convallis,182,2023-09-13T06:54:34Z,1
837,155,Message,lacinia aenean sit amet justo morbi ut odio cras mi pede malesuada in imperdiet et commodo vulputate,585,2024-02-20T17:33:45Z,1
838,631,Story,dui luctus rutrum nulla tellus in sagittis dui vel nisl duis ac nibh fusce lacus purus aliquet,369,2023-05-28T08:39:09Z,1
839,837,Story,ut tellus nulla ut erat id mauris vulputate elementum nullam varius nulla facilisi cras non velit nec nisi vulputate,484,2023-07-30T00:35:24Z,1
840,649,Story,id justo sit amet sapien dignissim vestibulum vestibulum ante ipsum primis,195,2023-11-25T04:17:33Z,1
841,513,Story,luctus et ultrices posuere cubilia curae duis faucibus accumsan odio curabitur convallis duis consequat dui nec nisi volutpat eleifend,404,2023-07-10T10:15:40Z,1
842,356,Message,erat curabitur gravida nisi at nibh in hac habitasse platea,594,2023-09-27T22:50:29Z,1
843,131,Story,tortor duis mattis egestas metus aenean fermentum donec ut mauris eget massa tempor convallis,960,2023-05-27T02:34:57Z,1
844,538,Story,tellus nisi eu orci mauris lacinia sapien quis libero nullam sit amet turpis elementum ligula vehicula,569,2023-12-08T09:08:21Z,1
845,877,Story,commodo vulputate justo in blandit ultrices enim lorem ipsum dolor sit amet consectetuer,152,2023-05-14T13:13:27Z,1
846,527,Message,lacinia aenean sit amet justo morbi ut odio cras mi pede malesuada in,815,2023-04-13T12:13:47Z,1
847,596,Message,justo lacinia eget tincidunt eget tempus vel pede morbi porttitor lorem id ligula suspendisse ornare consequat lectus in est risus,937,2023-05-30T09:12:22Z,1
848,460,Story,ut blandit non interdum in ante vestibulum ante ipsum primis in faucibus orci luctus et ultrices,857,2023-03-12T09:00:16Z,1
849,919,Story,morbi non quam nec dui luctus rutrum nulla tellus in sagittis dui vel nisl duis,155,2024-02-22T03:01:08Z,1
850,419,Message,rhoncus aliquam lacus morbi quis tortor id nulla ultrices aliquet maecenas leo odio condimentum id luctus,943,2023-06-08T05:18:14Z,1
851,548,Message,curae nulla dapibus dolor vel est donec odio justo sollicitudin ut suscipit a feugiat et eros vestibulum,113,2023-11-04T08:01:09Z,1
852,972,Story,nullam porttitor lacus at turpis donec posuere metus vitae ipsum aliquam non mauris morbi non lectus aliquam sit amet diam,684,2023-03-07T08:03:04Z,1
853,779,Story,vestibulum sit amet cursus id turpis integer aliquet massa id,20,2024-02-24T01:05:12Z,1
854,218,Story,neque libero convallis eget eleifend luctus ultricies eu nibh quisque id justo sit amet,597,2023-03-07T21:51:40Z,1
855,583,Story,amet diam in magna bibendum imperdiet nullam orci pede venenatis non sodales sed tincidunt eu,869,2024-02-05T12:46:40Z,1
856,667,Story,odio consequat varius integer ac leo pellentesque ultrices mattis odio,742,2023-07-01T01:00:16Z,1
857,359,Message,erat tortor sollicitudin mi sit amet lobortis sapien sapien non mi integer ac neque,950,2023-05-08T02:02:18Z,1
858,975,Story,erat volutpat in congue etiam justo etiam pretium iaculis justo in hac habitasse platea dictumst etiam faucibus,208,2023-03-08T07:10:10Z,1
859,543,Story,in lacus curabitur at ipsum ac tellus semper interdum mauris ullamcorper purus sit amet nulla quisque arcu libero rutrum ac,192,2024-02-13T18:38:11Z,1
860,351,Message,viverra diam vitae quam suspendisse potenti nullam porttitor lacus at turpis donec posuere metus vitae ipsum aliquam non,165,2023-12-29T01:50:10Z,1
861,759,Story,turpis donec posuere metus vitae ipsum aliquam non mauris morbi non lectus,781,2023-05-08T03:10:11Z,1
862,599,Story,adipiscing molestie hendrerit at vulputate vitae nisl aenean lectus pellentesque eget nunc donec quis orci,390,2024-01-29T23:20:10Z,1
863,485,Story,ante vestibulum ante ipsum primis in faucibus orci luctus et ultrices posuere,488,2023-09-27T21:53:25Z,1
864,605,Message,ut ultrices vel augue vestibulum ante ipsum primis in faucibus orci luctus,611,2023-06-16T08:05:43Z,1
865,845,Story,arcu adipiscing molestie hendrerit at vulputate vitae nisl aenean lectus pellentesque eget nunc donec quis orci eget,275,2023-08-28T18:48:19Z,1
866,676,Message,vulputate vitae nisl aenean lectus pellentesque eget nunc donec quis orci eget orci vehicula condimentum curabitur in libero ut,871,2024-01-03T19:17:36Z,1
867,344,Story,nisi vulputate nonummy maecenas tincidunt lacus at velit vivamus vel nulla eget eros,585,2023-07-01T17:33:39Z,1
868,329,Story,felis donec semper sapien a libero nam dui proin leo odio,845,2024-02-07T03:30:04Z,1
869,204,Story,lacinia sapien quis libero nullam sit amet turpis elementum ligula vehicula consequat morbi a ipsum integer,651,2023-10-22T19:05:19Z,1
870,920,Message,nec dui luctus rutrum nulla tellus in sagittis dui vel nisl duis ac nibh fusce lacus purus,154,2023-05-28T21:20:54Z,1
871,14,Message,proin interdum mauris non ligula pellentesque ultrices phasellus id sapien in sapien iaculis,118,2023-08-25T06:51:12Z,1
872,517,Message,pharetra magna vestibulum aliquet ultrices erat tortor sollicitudin mi sit amet lobortis sapien sapien non mi,140,2024-01-29T08:41:41Z,1
873,999,Story,sit amet diam in magna bibendum imperdiet nullam orci pede venenatis non sodales sed,70,2023-05-24T01:42:13Z,1
874,718,Message,non pretium quis lectus suspendisse potenti in eleifend quam a odio,638,2023-05-30T05:59:59Z,1
875,623,Message,ultrices erat tortor sollicitudin mi sit amet lobortis sapien sapien non mi integer ac neque duis bibendum morbi non,683,2023-11-30T10:44:21Z,1
876,680,Story,phasellus id sapien in sapien iaculis congue vivamus metus arcu,53,2023-04-18T08:10:57Z,1
877,769,Message,tincidunt lacus at velit vivamus vel nulla eget eros elementum pellentesque quisque porta volutpat erat,761,2024-01-31T06:08:10Z,1
878,189,Message,luctus et ultrices posuere cubilia curae mauris viverra diam vitae quam suspendisse,180,2023-08-06T14:26:37Z,1
879,550,Message,ipsum primis in faucibus orci luctus et ultrices posuere cubilia curae donec pharetra magna vestibulum aliquet ultrices erat tortor,404,2023-11-03T11:37:12Z,1
880,532,Story,ligula nec sem duis aliquam convallis nunc proin at turpis a pede posuere nonummy integer non,777,2023-07-06T19:29:34Z,1
881,777,Story,proin interdum mauris non ligula pellentesque ultrices phasellus id sapien in sapien iaculis congue vivamus metus,960,2023-03-28T11:47:20Z,1
882,944,Story,convallis tortor risus dapibus augue vel accumsan tellus nisi eu orci mauris lacinia,291,2023-09-10T10:30:11Z,1
883,313,Story,sapien dignissim vestibulum vestibulum ante ipsum primis in faucibus orci luctus et ultrices posuere cubilia curae nulla dapibus,30,2023-03-11T06:17:08Z,1
884,672,Message,consectetuer adipiscing elit proin risus praesent lectus vestibulum quam sapien varius ut blandit non interdum in ante vestibulum,916,2023-03-12T14:08:34Z,1
885,222,Message,posuere felis sed lacus morbi sem mauris laoreet ut rhoncus aliquet pulvinar sed nisl nunc rhoncus dui vel sem sed,209,2023-10-17T10:00:58Z,1
886,823,Message,fringilla rhoncus mauris enim leo rhoncus sed vestibulum sit amet cursus id turpis integer aliquet,958,2023-06-16T00:59:38Z,1
887,706,Story,enim blandit mi in porttitor pede justo eu massa donec dapibus duis,237,2023-10-24T01:59:53Z,1
888,671,Message,ac leo pellentesque ultrices mattis odio donec vitae nisi nam ultrices libero non mattis pulvinar nulla,393,2023-08-16T21:57:53Z,1
889,235,Story,pede libero quis orci nullam molestie nibh in lectus pellentesque at nulla suspendisse potenti cras in purus eu magna,962,2023-03-10T08:51:58Z,1
890,47,Message,rutrum neque aenean auctor gravida sem praesent id massa id,11,2023-05-07T11:58:42Z,1
891,655,Story,in faucibus orci luctus et ultrices posuere cubilia curae nulla dapibus dolor vel est donec odio justo sollicitudin ut,268,2023-03-05T17:49:53Z,1
892,636,Story,cras pellentesque volutpat dui maecenas tristique est et tempus semper est quam pharetra magna ac consequat metus,310,2024-01-17T15:42:31Z,1
893,363,Story,duis at velit eu est congue elementum in hac habitasse platea dictumst morbi vestibulum velit,790,2023-10-07T15:35:08Z,1
894,73,Message,dui maecenas tristique est et tempus semper est quam pharetra magna ac,609,2023-05-15T10:02:57Z,1
895,973,Story,nulla ultrices aliquet maecenas leo odio condimentum id luctus nec molestie sed,8,2023-08-14T18:10:21Z,1
896,62,Message,pretium nisl ut volutpat sapien arcu sed augue aliquam erat volutpat in congue etiam,824,2023-09-07T14:38:42Z,1
897,856,Message,semper porta volutpat quam pede lobortis ligula sit amet eleifend,246,2023-03-25T14:08:29Z,1
898,94,Story,mauris laoreet ut rhoncus aliquet pulvinar sed nisl nunc rhoncus dui,458,2024-01-10T02:25:27Z,1
899,372,Story,magna at nunc commodo placerat praesent blandit nam nulla integer pede justo lacinia eget tincidunt eget tempus vel pede,531,2023-08-31T13:51:30Z,1
900,554,Story,nascetur ridiculus mus vivamus vestibulum sagittis sapien cum sociis natoque penatibus et magnis dis parturient montes,466,2023-07-04T08:01:01Z,1
901,164,Story,nulla integer pede justo lacinia eget tincidunt eget tempus vel,306,2024-02-20T23:53:12Z,1
902,643,Story,lobortis ligula sit amet eleifend pede libero quis orci nullam molestie nibh in lectus pellentesque at nulla suspendisse potenti,378,2024-01-25T23:11:31Z,1
903,12,Message,purus eu magna vulputate luctus cum sociis natoque penatibus et magnis dis parturient montes nascetur ridiculus mus,612,2023-08-25T04:24:02Z,1
904,454,Message,pulvinar nulla pede ullamcorper augue a suscipit nulla elit ac,89,2023-10-24T05:17:35Z,1
905,403,Story,gravida sem praesent id massa id nisl venenatis lacinia aenean sit amet justo morbi ut odio cras mi pede malesuada,634,2023-05-02T20:41:17Z,1
906,223,Story,proin risus praesent lectus vestibulum quam sapien varius ut blandit non interdum in ante vestibulum ante ipsum,187,2023-06-28T19:49:27Z,1
907,828,Message,erat fermentum justo nec condimentum neque sapien placerat ante nulla justo aliquam quis,251,2023-07-22T16:44:52Z,1
908,193,Message,in faucibus orci luctus et ultrices posuere cubilia curae nulla dapibus dolor vel est donec,365,2023-10-09T21:51:10Z,1
909,777,Story,pede libero quis orci nullam molestie nibh in lectus pellentesque at nulla suspendisse,749,2024-01-12T08:30:41Z,1
910,959,Message,a ipsum integer a nibh in quis justo maecenas rhoncus aliquam lacus morbi quis tortor id nulla,861,2023-05-06T16:48:12Z,1
911,408,Story,ligula nec sem duis aliquam convallis nunc proin at turpis a pede,129,2023-05-28T17:04:09Z,1
912,67,Message,pulvinar nulla pede ullamcorper augue a suscipit nulla elit ac nulla sed vel enim sit amet nunc,97,2023-08-05T10:59:03Z,1
913,127,Message,non ligula pellentesque ultrices phasellus id sapien in sapien iaculis congue vivamus metus arcu adipiscing molestie hendrerit,588,2023-11-21T18:46:30Z,1
914,833,Message,nulla eget eros elementum pellentesque quisque porta volutpat erat quisque erat eros viverra eget congue,662,2023-09-23T13:56:06Z,1
915,783,Story,dolor vel est donec odio justo sollicitudin ut suscipit a feugiat et eros vestibulum ac est lacinia nisi venenatis tristique,428,2023-05-25T19:49:39Z,1
916,265,Story,at turpis a pede posuere nonummy integer non velit donec diam neque vestibulum eget vulputate ut ultrices vel augue,512,2023-05-04T02:13:39Z,1
917,449,Story,eget semper rutrum nulla nunc purus phasellus in felis donec,800,2023-03-13T13:47:44Z,1
918,738,Message,volutpat erat quisque erat eros viverra eget congue eget semper rutrum,766,2024-02-18T17:14:30Z,1
919,163,Message,non lectus aliquam sit amet diam in magna bibendum imperdiet nullam orci pede venenatis non sodales sed tincidunt,961,2024-01-16T12:55:26Z,1
920,919,Story,ultrices mattis odio donec vitae nisi nam ultrices libero non mattis pulvinar nulla,433,2023-08-18T11:44:01Z,1
921,175,Message,pulvinar sed nisl nunc rhoncus dui vel sem sed sagittis nam congue risus semper porta volutpat quam pede,501,2023-08-31T17:11:10Z,1
922,599,Story,cursus urna ut tellus nulla ut erat id mauris vulputate elementum nullam varius nulla facilisi cras non velit nec,448,2023-11-01T20:10:19Z,1
923,442,Story,ipsum praesent blandit lacinia erat vestibulum sed magna at nunc commodo placerat praesent blandit nam nulla integer pede justo,744,2024-02-05T05:13:56Z,1
924,790,Message,porttitor id consequat in consequat ut nulla sed accumsan felis ut at dolor quis odio consequat varius,320,2023-07-12T19:24:57Z,1
925,411,Message,sociis natoque penatibus et magnis dis parturient montes nascetur ridiculus mus etiam vel augue vestibulum rutrum rutrum neque aenean auctor,859,2023-06-14T21:59:38Z,1
926,626,Story,posuere cubilia curae mauris viverra diam vitae quam suspendisse potenti nullam porttitor lacus,250,2023-08-23T23:11:59Z,1
927,664,Message,luctus cum sociis natoque penatibus et magnis dis parturient montes nascetur ridiculus mus vivamus vestibulum sagittis sapien cum sociis,504,2023-12-31T23:50:57Z,1
928,885,Story,ultrices enim lorem ipsum dolor sit amet consectetuer adipiscing elit proin interdum mauris,285,2023-03-18T10:17:53Z,1
929,35,Message,est et tempus semper est quam pharetra magna ac consequat metus sapien ut nunc vestibulum ante,254,2023-12-26T03:37:06Z,1
930,812,Message,interdum mauris non ligula pellentesque ultrices phasellus id sapien in sapien iaculis congue vivamus,885,2023-04-11T09:19:33Z,1
931,231,Message,in sapien iaculis congue vivamus metus arcu adipiscing molestie hendrerit at vulputate vitae nisl,574,2023-07-14T02:03:56Z,1
