id,user_id,post_type,content,recipient_id,created_at,is_visible
1,88,Message,eget eleifend luctus ultricies eu nibh quisque id justo sit amet sapien,417,2023-09-02T08:55:06Z,1
2,397,Story,aliquet maecenas leo odio condimentum id luctus nec molestie sed justo pellentesque viverra pede ac diam cras,912,2023-09-27T14:05:57Z,1
3,944,Message,amet nunc viverra dapibus nulla suscipit ligula in lacus curabitur at ipsum ac tellus semper interdum mauris ullamcorper,676,2023-12-27T16:31:53Z,1
4,181,Story,aliquet massa id lobortis convallis tortor risus dapibus augue vel accumsan tellus nisi eu orci mauris lacinia,558,2023-09-13T19:02:40Z,1
5,786,Story,sed justo pellentesque viverra pede ac diam cras pellentesque volutpat,213,2023-07-13T17:16:45Z,1
6,181,Story,commodo placerat praesent blandit nam nulla integer pede justo lacinia eget tincidunt eget tempus vel pede morbi porttitor,232,2023-09-15T09:31:03Z,1
7,535,Message,interdum mauris non ligula pellentesque ultrices phasellus id sapien in sapien iaculis congue vivamus metus arcu adipiscing molestie hendrerit,743,2023-03-21T01:49:27Z,1
8,826,Message,ante vestibulum ante ipsum primis in faucibus orci luctus et,713,2023-06-12T01:06:53Z,1
9,152,Message,at nibh in hac habitasse platea dictumst aliquam augue quam sollicitudin,255,2024-02-19T07:44:32Z,1
10,398,Story,at nulla suspendisse potenti cras in purus eu magna vulputate luctus cum,935,2023-09-23T05:40:22Z,1
11,808,Message,tellus nisi eu orci mauris lacinia sapien quis libero nullam sit amet turpis elementum ligula vehicula consequat morbi a,138,2023-05-29T00:58:19Z,1
12,581,Message,rhoncus dui vel sem sed sagittis nam congue risus semper porta volutpat quam pede lobortis ligula sit amet eleifend,353,2023-09-02T00:10:14Z,1
13,141,Message,convallis duis consequat dui nec nisi volutpat eleifend donec ut dolor morbi vel lectus in,896,2023-07-11T15:58:50Z,1
14,371,Message,feugiat non pretium quis lectus suspendisse potenti in eleifend quam a odio in hac habitasse platea dictumst maecenas ut,505,2023-04-08T21:44:21Z,1
15,836,Story,dignissim vestibulum vestibulum ante ipsum primis in faucibus orci luctus et ultrices,519,2023-04-25T06:55:16Z,1
16,554,Story,lacinia nisi venenatis tristique fusce congue diam id ornare imperdiet sapien urna pretium nisl,355,2023-11-01T08:40:20Z,1
17,705,Message,id ligula suspendisse ornare consequat lectus in est risus auctor sed tristique in tempus sit amet sem fusce consequat,665,2024-02-17T21:19:43Z,1
18,414,Story,eleifend donec ut dolor morbi vel lectus in quam fringilla rhoncus,155,2023-10-04T19:28:42Z,1
19,751,Message,sagittis dui vel nisl duis ac nibh fusce lacus purus aliquet at feugiat non pretium quis lectus suspendisse potenti in,665,2023-07-28T22:04:16Z,1
20,510,Story,morbi non lectus aliquam sit amet diam in magna bibendum imperdiet nullam orci pede venenatis non,6,2023-06-08T04:40:48Z,1
21,200,Message,odio donec vitae nisi nam ultrices libero non mattis pulvinar nulla pede ullamcorper augue a suscipit nulla elit,238,2024-02-18T13:20:17Z,1
22,21,Message,in felis eu sapien cursus vestibulum proin eu mi nulla ac enim in tempor turpis nec euismod scelerisque quam,887,2023-05-14T02:22:18Z,1
23,221,Story,justo in blandit ultrices enim lorem ipsum dolor sit amet consectetuer adipiscing elit proin interdum mauris,704,2023-06-27T15:24:12Z,1
24,24,Story,nulla ultrices aliquet maecenas leo odio condimentum id luctus nec molestie,889,2023-08-22T09:27:33Z,1
25,42,Story,et magnis dis parturient montes nascetur ridiculus mus vivamus vestibulum sagittis sapien cum sociis natoque penatibus et magnis dis parturient,317,2023-08-22T21:42:27Z,1
26,385,Message,nunc rhoncus dui vel sem sed sagittis nam congue risus semper,392,2023-08-17T22:30:00Z,1
27,77,Story,sollicitudin ut suscipit a feugiat et eros vestibulum ac est lacinia nisi venenatis tristique fusce congue,44,2023-07-18T09:41:27Z,1
28,919,Message,quam turpis adipiscing lorem vitae mattis nibh ligula nec sem duis aliquam convallis nunc proin at turpis,279,2023-09-08T18:09:01Z,1
29,949,Story,potenti cras in purus eu magna vulputate luctus cum sociis natoque penatibus et magnis dis parturient montes nascetur,752,2023-10-24T09:07:01Z,1
30,829,Story,ligula nec sem duis aliquam convallis nunc proin at turpis a pede posuere nonummy integer non velit donec diam neque,173,2023-04-11T18:53:54Z,1
31,792,Message,sit amet nulla quisque arcu libero rutrum ac lobortis vel dapibus at diam nam tristique,248,2023-03-18T06:23:45Z,1
32,207,Story,pretium iaculis justo in hac habitasse platea dictumst etiam faucibus cursus urna,811,2023-04-01T18:40:12Z,1
33,780,Message,porttitor lorem id ligula suspendisse ornare consequat lectus in est risus auctor sed tristique in tempus sit,238,2023-04-04T12:02:41Z,1
34,337,Story,sit amet sapien dignissim vestibulum vestibulum ante ipsum primis in,217,2023-09-21T06:10:51Z,1
35,277,Story,lorem ipsum dolor sit amet consectetuer adipiscing elit proin interdum mauris non ligula pellentesque ultrices phasellus id sapien,488,2023-09-04T16:02:03Z,1
36,404,Story,vulputate nonummy maecenas tincidunt lacus at velit vivamus vel nulla eget eros elementum pellentesque quisque porta volutpat erat quisque,833,2023-02-23T11:32:17Z,1
37,986,Story,at velit vivamus vel nulla eget eros elementum pellentesque quisque porta volutpat erat quisque erat eros viverra eget congue eget,20,2023-04-04T00:36:13Z,1
38,288,Story,dolor sit amet consectetuer adipiscing elit proin interdum mauris non ligula pellentesque ultrices phasellus id,70,2023-11-09T13:07:56Z,1
39,880,Message,quam nec dui luctus rutrum nulla tellus in sagittis dui vel nisl duis ac,676,2023-08-09T14:24:39Z,1
40,756,Message,velit vivamus vel nulla eget eros elementum pellentesque quisque porta volutpat erat quisque erat eros viverra eget,443,2023-10-15T16:25:21Z,1
41,951,Story,id nisl venenatis lacinia aenean sit amet justo morbi ut odio cras mi,691,2023-09-03T08:56:52Z,1
42,796,Story,non mauris morbi non lectus aliquam sit amet diam in magna bibendum imperdiet nullam orci pede venenatis non sodales,274,2023-03-19T20:40:03Z,1
43,419,Story,volutpat erat quisque erat eros viverra eget congue eget semper rutrum nulla nunc purus phasellus,323,2023-04-22T05:13:04Z,1
44,806,Message,justo lacinia eget tincidunt eget tempus vel pede morbi porttitor lorem id ligula suspendisse ornare consequat lectus in est,835,2024-02-13T10:02:28Z,1
45,120,Message,feugiat et eros vestibulum ac est lacinia nisi venenatis tristique fusce congue diam id ornare imperdiet sapien urna pretium nisl,603,2024-01-26T07:06:51Z,1
46,687,Story,dapibus dolor vel est donec odio justo sollicitudin ut suscipit a feugiat et,678,2023-05-09T15:38:23Z,1
47,307,Message,mauris vulputate elementum nullam varius nulla facilisi cras non velit nec nisi vulputate nonummy maecenas tincidunt,70,2023-03-04T14:31:15Z,1
48,991,Message,ante ipsum primis in faucibus orci luctus et ultrices posuere cubilia,662,2023-11-02T08:36:26Z,1
49,188,Story,sapien cursus vestibulum proin eu mi nulla ac enim in tempor turpis nec euismod scelerisque,783,2023-07-11T16:21:07Z,1
50,294,Message,augue luctus tincidunt nulla mollis molestie lorem quisque ut erat curabitur gravida nisi at nibh in hac habitasse platea dictumst,707,2024-01-28T23:49:13Z,1
51,384,Story,nec sem duis aliquam convallis nunc proin at turpis a pede posuere,569,2023-11-25T07:07:40Z,1
52,46,Story,vel nisl duis ac nibh fusce lacus purus aliquet at feugiat,108,2023-07-27T23:54:39Z,1
53,816,Message,iaculis congue vivamus metus arcu adipiscing molestie hendrerit at vulputate vitae,353,2024-01-24T02:32:25Z,1
54,733,Message,eget orci vehicula condimentum curabitur in libero ut massa volutpat convallis morbi,574,2023-10-22T12:29:21Z,1
55,231,Story,massa quis augue luctus tincidunt nulla mollis molestie lorem quisque ut erat curabitur gravida nisi at nibh in hac habitasse,864,2023-10-05T07:37:18Z,1
56,928,Message,amet justo morbi ut odio cras mi pede malesuada in,784,2023-08-05T20:09:09Z,1
57,249,Message,lobortis ligula sit amet eleifend pede libero quis orci nullam molestie nibh in lectus pellentesque at nulla suspendisse potenti,282,2023-10-01T17:59:09Z,1
58,761,Message,eu massa donec dapibus duis at velit eu est congue elementum in,757,2023-09-03T17:12:09Z,1
59,165,Message,pede justo eu massa donec dapibus duis at velit eu est congue elementum in hac habitasse platea,921,2024-01-02T07:13:26Z,1
60,385,Story,pellentesque ultrices mattis odio donec vitae nisi nam ultrices libero non mattis pulvinar nulla pede ullamcorper,808,2023-08-28T18:23:34Z,1
61,576,Story,magnis dis parturient montes nascetur ridiculus mus vivamus vestibulum sagittis sapien cum sociis natoque penatibus et magnis dis parturient,59,2023-05-21T07:03:56Z,1
62,651,Story,nulla nisl nunc nisl duis bibendum felis sed interdum venenatis turpis enim blandit,748,2023-07-19T13:50:39Z,1
63,766,Message,elit ac nulla sed vel enim sit amet nunc viverra dapibus nulla suscipit ligula in lacus curabitur at ipsum,326,2023-03-04T04:55:54Z,1
64,344,Story,odio porttitor id consequat in consequat ut nulla sed accumsan felis ut at dolor quis,423,2023-10-21T13:34:10Z,1
65,69,Story,ultrices vel augue vestibulum ante ipsum primis in faucibus orci luctus et ultrices posuere cubilia,182,2023-05-15T08:19:23Z,1
66,653,Message,bibendum morbi non quam nec dui luctus rutrum nulla tellus in sagittis dui vel nisl duis ac nibh,667,2023-07-13T18:59:49Z,1
67,746,Story,erat eros viverra eget congue eget semper rutrum nulla nunc purus phasellus in felis donec semper sapien a libero,190,2024-01-06T20:54:46Z,1
68,628,Story,pede lobortis ligula sit amet eleifend pede libero quis orci nullam molestie nibh in lectus pellentesque at,684,2023-09-23T14:51:32Z,1
69,660,Message,erat nulla tempus vivamus in felis eu sapien cursus vestibulum proin eu mi,913,2023-09-16T05:21:01Z,1
70,854,Message,interdum mauris non ligula pellentesque ultrices phasellus id sapien in sapien iaculis congue vivamus,32,2023-08-26T02:39:11Z,1
71,471,Story,consequat lectus in est risus auctor sed tristique in tempus sit amet sem fusce consequat nulla nisl nunc nisl duis,87,2023-08-04T02:51:32Z,1
72,573,Message,sociis natoque penatibus et magnis dis parturient montes nascetur ridiculus mus etiam,889,2023-05-30T15:58:45Z,1
73,891,Message,faucibus orci luctus et ultrices posuere cubilia curae mauris viverra diam vitae quam suspendisse potenti nullam porttitor,335,2023-08-05T07:12:21Z,1
74,828,Story,ut at dolor quis odio consequat varius integer ac leo pellentesque ultrices mattis odio donec vitae nisi,813,2023-03-27T10:59:05Z,1
75,896,Message,nisl nunc nisl duis bibendum felis sed interdum venenatis turpis enim blandit mi in porttitor pede justo eu,551,2023-03-04T01:17:53Z,1
76,247,Message,eget nunc donec quis orci eget orci vehicula condimentum curabitur in libero ut massa volutpat,340,2023-05-10T20:15:14Z,1
77,116,Message,vulputate ut ultrices vel augue vestibulum ante ipsum primis in,445,2023-07-18T16:23:07Z,1
78,660,Story,platea dictumst maecenas ut massa quis augue luctus tincidunt nulla mollis molestie lorem quisque ut erat curabitur,88,2023-11-28T02:51:25Z,1
79,53,Message,ut volutpat sapien arcu sed augue aliquam erat volutpat in,229,2024-02-01T00:04:36Z,1
80,439,Story,congue elementum in hac habitasse platea dictumst morbi vestibulum velit id pretium iaculis diam erat fermentum justo nec,463,2024-02-05T17:36:46Z,1
81,744,Message,primis in faucibus orci luctus et ultrices posuere cubilia curae nulla dapibus dolor vel est donec,472,2023-06-30T19:20:17Z,1
82,143,Story,aliquam sit amet diam in magna bibendum imperdiet nullam orci pede venenatis non sodales sed,103,2024-02-14T14:10:58Z,1
83,583,Story,velit eu est congue elementum in hac habitasse platea dictumst morbi vestibulum velit,293,2023-03-21T19:05:38Z,1
84,550,Message,sit amet consectetuer adipiscing elit proin risus praesent lectus vestibulum,591,2024-02-25T12:40:56Z,1
85,516,Story,est donec odio justo sollicitudin ut suscipit a feugiat et eros vestibulum ac est lacinia nisi venenatis tristique fusce,200,2024-01-15T09:26:39Z,1
86,71,Story,morbi vel lectus in quam fringilla rhoncus mauris enim leo rhoncus sed vestibulum sit amet cursus id turpis,982,2023-04-26T22:32:13Z,1
87,180,Story,in lectus pellentesque at nulla suspendisse potenti cras in purus eu magna vulputate luctus cum sociis natoque penatibus et magnis,739,2023-03-13T00:46:23Z,1
88,998,Story,quis lectus suspendisse potenti in eleifend quam a odio in hac habitasse platea dictumst maecenas ut massa,65,2023-08-20T20:38:34Z,1
89,711,Message,convallis nunc proin at turpis a pede posuere nonummy integer non velit donec diam,428,2023-11-20T22:22:23Z,1
90,438,Message,ligula in lacus curabitur at ipsum ac tellus semper interdum mauris ullamcorper purus sit amet nulla,951,2023-04-03T17:32:45Z,1
91,691,Message,lectus pellentesque eget nunc donec quis orci eget orci vehicula condimentum curabitur,530,2023-12-28T23:44:29Z,1
92,687,Story,magnis dis parturient montes nascetur ridiculus mus etiam vel augue vestibulum rutrum rutrum,64,2023-11-19T12:43:40Z,1
93,527,Story,ac diam cras pellentesque volutpat dui maecenas tristique est et tempus semper est quam pharetra magna ac,353,2023-07-01T11:40:09Z,1
94,106,Message,mattis egestas metus aenean fermentum donec ut mauris eget massa tempor convallis,283,2024-01-20T12:29:04Z,1
95,317,Message,quam nec dui luctus rutrum nulla tellus in sagittis dui vel,912,2023-11-30T02:06:29Z,1
96,470,Story,velit donec diam neque vestibulum eget vulputate ut ultrices vel augue vestibulum ante ipsum primis,111,2023-11-22T05:07:26Z,1
97,743,Message,volutpat eleifend donec ut dolor morbi vel lectus in quam fringilla rhoncus mauris enim leo rhoncus sed,422,2023-08-02T04:39:58Z,1
98,191,Story,accumsan odio curabitur convallis duis consequat dui nec nisi volutpat eleifend donec ut dolor morbi vel lectus,585,2023-10-25T17:47:30Z,1
99,413,Story,mauris non ligula pellentesque ultrices phasellus id sapien in sapien iaculis congue vivamus metus arcu adipiscing molestie hendrerit at vulputate,170,2023-12-25T19:39:42Z,1
100,973,Message,neque libero convallis eget eleifend luctus ultricies eu nibh quisque id,242,2023-12-23T13:17:28Z,1
101,992,Message,nulla nisl nunc nisl duis bibendum felis sed interdum venenatis turpis enim blandit mi in porttitor pede justo eu massa,787,2023-03-16T03:02:19Z,1
102,138,Story,lorem ipsum dolor sit amet consectetuer adipiscing elit proin interdum mauris non ligula pellentesque ultrices phasellus id sapien,569,2023-03-27T10:09:15Z,1
103,647,Story,porta volutpat quam pede lobortis ligula sit amet eleifend pede libero quis orci nullam molestie nibh in lectus pellentesque at,463,2023-07-05T00:47:03Z,1
104,490,Story,in sapien iaculis congue vivamus metus arcu adipiscing molestie hendrerit at vulputate vitae nisl aenean lectus pellentesque eget,797,2023-09-04T23:27:37Z,1
105,295,Message,massa id nisl venenatis lacinia aenean sit amet justo morbi ut odio cras mi,542,2024-02-11T15:27:11Z,1
106,324,Story,interdum mauris ullamcorper purus sit amet nulla quisque arcu libero rutrum ac,366,2023-08-01T12:10:47Z,1
107,419,Message,proin at turpis a pede posuere nonummy integer non velit donec diam neque vestibulum eget vulputate ut ultrices,719,2023-09-18T00:56:48Z,1
108,718,Message,integer ac leo pellentesque ultrices mattis odio donec vitae nisi,712,2023-05-08T01:04:45Z,1
109,496,Story,rhoncus aliquam lacus morbi quis tortor id nulla ultrices aliquet maecenas leo odio condimentum id luctus nec molestie sed,741,2024-01-02T09:45:01Z,1
110,13,Message,mattis egestas metus aenean fermentum donec ut mauris eget massa tempor convallis nulla neque,961,2023-08-28T05:14:02Z,1
111,942,Story,sed tincidunt eu felis fusce posuere felis sed lacus morbi sem mauris laoreet ut rhoncus aliquet pulvinar sed,956,2023-03-13T12:12:53Z,1
112,672,Message,rutrum nulla nunc purus phasellus in felis donec semper sapien a libero,172,2023-08-19T17:56:24Z,1
113,371,Message,quisque porta volutpat erat quisque erat eros viverra eget congue eget semper rutrum nulla nunc purus phasellus,920,2023-11-08T00:42:15Z,1
114,161,Story,ipsum primis in faucibus orci luctus et ultrices posuere cubilia curae donec pharetra magna vestibulum,751,2024-01-30T02:06:18Z,1
115,827,Message,consequat metus sapien ut nunc vestibulum ante ipsum primis in faucibus orci luctus et ultrices posuere cubilia curae mauris,229,2023-03-03T12:25:18Z,1
116,757,Story,commodo vulputate justo in blandit ultrices enim lorem ipsum dolor sit amet,787,2023-06-06T00:02:32Z,1
117,266,Message,vestibulum ante ipsum primis in faucibus orci luctus et ultrices posuere cubilia curae nulla dapibus dolor vel est,454,2023-08-19T01:09:29Z,1
118,337,Story,pretium quis lectus suspendisse potenti in eleifend quam a odio in hac habitasse platea dictumst,708,2023-05-19T03:14:34Z,1
119,469,Message,integer a nibh in quis justo maecenas rhoncus aliquam lacus morbi quis tortor id,455,2023-10-06T18:35:36Z,1
120,586,Message,gravida nisi at nibh in hac habitasse platea dictumst aliquam augue quam sollicitudin vitae consectetuer,654,2023-07-21T01:57:46Z,1
121,445,Story,cubilia curae mauris viverra diam vitae quam suspendisse potenti nullam porttitor lacus at turpis donec,614,2023-03-18T15:17:40Z,1
122,270,Story,ligula nec sem duis aliquam convallis nunc proin at turpis a pede posuere nonummy integer non velit donec diam neque,146,2024-02-11T05:02:22Z,1
123,551,Story,quisque ut erat curabitur gravida nisi at nibh in hac,411,2023-08-11T01:02:56Z,1
124,447,Story,mauris vulputate elementum nullam varius nulla facilisi cras non velit nec nisi vulputate nonummy maecenas tincidunt,375,2023-10-04T18:55:37Z,1
125,782,Message,nulla dapibus dolor vel est donec odio justo sollicitudin ut suscipit a feugiat et eros vestibulum ac est,150,2023-12-22T21:36:38Z,1
126,853,Story,duis at velit eu est congue elementum in hac habitasse platea dictumst morbi vestibulum,839,2023-03-07T15:36:01Z,1
127,299,Story,et eros vestibulum ac est lacinia nisi venenatis tristique fusce congue diam id ornare imperdiet,921,2023-07-23T23:20:39Z,1
128,232,Message,imperdiet nullam orci pede venenatis non sodales sed tincidunt eu felis,697,2024-01-27T17:20:40Z,1
129,975,Story,dignissim vestibulum vestibulum ante ipsum primis in faucibus orci luctus et ultrices posuere cubilia curae nulla dapibus,179,2023-10-07T03:57:19Z,1
130,715,Story,tincidunt nulla mollis molestie lorem quisque ut erat curabitur gravida nisi at nibh in hac habitasse,249,2023-11-07T08:38:13Z,1
131,329,Story,primis in faucibus orci luctus et ultrices posuere cubilia curae duis faucibus accumsan odio curabitur,790,2023-09-01T05:09:30Z,1
132,464,Message,quis lectus suspendisse potenti in eleifend quam a odio in hac,910,2023-09-28T04:56:39Z,1
133,330,Message,eu interdum eu tincidunt in leo maecenas pulvinar lobortis est phasellus sit amet erat nulla tempus vivamus in felis,758,2023-07-11T02:17:25Z,1
134,85,Story,elementum nullam varius nulla facilisi cras non velit nec nisi vulputate nonummy maecenas tincidunt lacus at velit vivamus vel,997,2024-02-07T16:30:19Z,1
135,42,Story,fermentum donec ut mauris eget massa tempor convallis nulla neque libero convallis eget eleifend luctus ultricies eu nibh quisque,769,2024-01-17T16:29:54Z,1
136,318,Story,justo in blandit ultrices enim lorem ipsum dolor sit amet,289,2024-02-10T08:44:06Z,1
137,392,Story,ut ultrices vel augue vestibulum ante ipsum primis in faucibus orci luctus et ultrices posuere,513,2023-04-08T10:24:10Z,1
138,242,Story,turpis eget elit sodales scelerisque mauris sit amet eros suspendisse accumsan tortor quis turpis sed ante vivamus tortor,606,2023-08-26T18:10:43Z,1
139,809,Story,montes nascetur ridiculus mus vivamus vestibulum sagittis sapien cum sociis natoque penatibus et magnis dis parturient montes nascetur,429,2024-02-11T06:07:42Z,1
140,287,Story,a odio in hac habitasse platea dictumst maecenas ut massa quis augue luctus tincidunt nulla mollis molestie lorem quisque ut,939,2023-12-17T09:17:59Z,1
141,426,Story,dapibus nulla suscipit ligula in lacus curabitur at ipsum ac tellus semper interdum mauris,745,2023-02-27T18:13:14Z,1
142,668,Message,felis fusce posuere felis sed lacus morbi sem mauris laoreet ut rhoncus aliquet pulvinar sed,236,2023-09-20T04:34:28Z,1
143,889,Message,lorem quisque ut erat curabitur gravida nisi at nibh in hac habitasse,308,2023-08-28T23:26:30Z,1
144,417,Story,ut at dolor quis odio consequat varius integer ac leo pellentesque ultrices mattis odio donec vitae nisi nam,447,2023-03-09T05:31:36Z,1
145,964,Message,justo sit amet sapien dignissim vestibulum vestibulum ante ipsum primis in faucibus,35,2023-06-06T14:29:23Z,1
146,990,Message,sed interdum venenatis turpis enim blandit mi in porttitor pede justo eu massa donec dapibus duis at velit eu est,803,2023-12-15T03:40:57Z,1
147,304,Story,in quam fringilla rhoncus mauris enim leo rhoncus sed vestibulum sit amet cursus,626,2023-10-08T02:58:45Z,1
148,608,Story,scelerisque quam turpis adipiscing lorem vitae mattis nibh ligula nec sem duis aliquam convallis nunc proin at turpis,853,2023-11-08T09:55:54Z,1
149,490,Story,consequat dui nec nisi volutpat eleifend donec ut dolor morbi vel lectus in quam fringilla rhoncus mauris enim leo,309,2023-05-02T21:03:00Z,1
150,170,Story,vestibulum aliquet ultrices erat tortor sollicitudin mi sit amet lobortis sapien sapien non mi integer ac neque duis bibendum,529,2023-08-20T06:59:43Z,1
151,442,Story,nunc nisl duis bibendum felis sed interdum venenatis turpis enim blandit mi in,183,2023-05-10T00:54:24Z,1
152,947,Message,morbi non quam nec dui luctus rutrum nulla tellus in sagittis dui vel nisl,99,2023-07-06T00:39:04Z,1
153,532,Story,augue vestibulum ante ipsum primis in faucibus orci luctus et ultrices posuere cubilia curae donec pharetra,726,2024-02-19T03:48:14Z,1
154,574,Message,luctus et ultrices posuere cubilia curae mauris viverra diam vitae quam suspendisse potenti nullam porttitor lacus at,798,2023-12-08T17:50:30Z,1
155,607,Story,a nibh in quis justo maecenas rhoncus aliquam lacus morbi quis tortor,833,2023-11-27T21:48:41Z,1
156,424,Story,ut nulla sed accumsan felis ut at dolor quis odio consequat varius integer ac leo,203,2023-07-31T02:24:05Z,1
157,136,Story,at velit eu est congue elementum in hac habitasse platea dictumst,923,2023-10-22T08:41:51Z,1
158,681,Story,cras pellentesque volutpat dui maecenas tristique est et tempus semper est quam pharetra magna ac consequat metus sapien ut nunc,318,2023-10-17T13:47:18Z,1
159,650,Message,faucibus cursus urna ut tellus nulla ut erat id mauris vulputate elementum nullam varius nulla facilisi cras non,686,2023-07-27T09:36:59Z,1
160,428,Story,pede venenatis non sodales sed tincidunt eu felis fusce posuere felis,439,2023-04-19T06:59:30Z,1
161,829,Story,erat quisque erat eros viverra eget congue eget semper rutrum nulla nunc purus phasellus in felis donec semper,573,2023-06-09T17:23:46Z,1
162,252,Message,id justo sit amet sapien dignissim vestibulum vestibulum ante ipsum primis in,139,2023-10-17T20:48:56Z,1
163,857,Message,maecenas pulvinar lobortis est phasellus sit amet erat nulla tempus vivamus in felis eu sapien cursus vestibulum proin eu mi,583,2023-06-28T20:51:41Z,1
164,491,Story,interdum mauris non ligula pellentesque ultrices phasellus id sapien in sapien iaculis congue vivamus metus arcu adipiscing molestie hendrerit at,997,2023-05-01T07:43:29Z,1
165,491,Story,primis in faucibus orci luctus et ultrices posuere cubilia curae donec pharetra magna vestibulum aliquet,908,2023-06-18T15:29:44Z,1
166,221,Message,pellentesque quisque porta volutpat erat quisque erat eros viverra eget congue eget semper rutrum nulla nunc purus,48,2024-01-15T08:32:18Z,1
167,375,Message,risus semper porta volutpat quam pede lobortis ligula sit amet eleifend pede libero quis orci nullam molestie nibh,979,2023-10-01T04:01:45Z,1
168,316,Message,proin risus praesent lectus vestibulum quam sapien varius ut blandit non interdum in ante vestibulum ante ipsum primis in,906,2023-11-02T12:26:24Z,1
169,613,Story,vulputate nonummy maecenas tincidunt lacus at velit vivamus vel nulla eget eros elementum pellentesque quisque porta volutpat erat quisque erat,132,2024-01-21T04:45:21Z,1
170,181,Message,cubilia curae nulla dapibus dolor vel est donec odio justo sollicitudin ut suscipit a feugiat et,230,2023-11-21T23:48:46Z,1
171,33,Message,ut massa volutpat convallis morbi odio odio elementum eu interdum eu tincidunt in leo maecenas pulvinar lobortis est,20,2023-06-05T02:56:44Z,1
172,759,Story,at turpis a pede posuere nonummy integer non velit donec diam neque vestibulum,179,2023-07-08T14:25:27Z,1
173,39,Message,libero nam dui proin leo odio porttitor id consequat in consequat ut nulla sed accumsan felis ut at,700,2023-12-19T07:59:33Z,1
174,750,Message,nulla ac enim in tempor turpis nec euismod scelerisque quam turpis,553,2023-06-22T09:51:23Z,1
175,329,Story,ultricies eu nibh quisque id justo sit amet sapien dignissim vestibulum vestibulum ante ipsum primis in faucibus orci luctus et,386,2023-11-26T18:00:59Z,1
176,682,Story,ultrices phasellus id sapien in sapien iaculis congue vivamus metus arcu adipiscing,536,2023-09-21T05:04:25Z,1
177,115,Message,orci nullam molestie nibh in lectus pellentesque at nulla suspendisse potenti cras in purus eu magna vulputate luctus cum,774,2023-11-17T09:22:32Z,1
178,846,Story,tincidunt lacus at velit vivamus vel nulla eget eros elementum pellentesque quisque porta,225,2023-03-23T01:33:35Z,1
179,812,Story,pretium nisl ut volutpat sapien arcu sed augue aliquam erat volutpat in congue,650,2023-05-11T03:14:14Z,1
180,250,Message,pretium iaculis justo in hac habitasse platea dictumst etiam faucibus cursus urna ut,454,2023-09-22T01:56:35Z,1
181,837,Story,convallis eget eleifend luctus ultricies eu nibh quisque id justo sit amet sapien dignissim vestibulum vestibulum ante ipsum,745,2023-12-03T08:28:50Z,1
182,726,Message,turpis elementum ligula vehicula consequat morbi a ipsum integer a nibh in,34,2024-02-01T10:54:05Z,1
183,879,Story,risus auctor sed tristique in tempus sit amet sem fusce consequat nulla nisl nunc nisl duis,298,2023-10-01T21:32:15Z,1
