id,user_id,post_type,content,recipient_id,created_at,is_visible
370,555,Story,sed vel enim sit amet nunc viverra dapibus nulla suscipit ligula in lacus curabitur at ipsum,741,2023-05-02T16:39:05Z,1
371,832,Message,dis parturient montes nascetur ridiculus mus vivamus vestibulum sagittis sapien cum sociis natoque penatibus et magnis dis parturient,855,2023-08-19T21:33:48Z,1
372,326,Story,lacus purus aliquet at feugiat non pretium quis lectus suspendisse potenti in,772,2023-12-30T15:57:20Z,1
373,57,Story,velit id pretium iaculis diam erat fermentum justo nec condimentum neque sapien placerat ante nulla,65,2023-06-06T07:42:41Z,1
374,43,Story,rhoncus aliquam lacus morbi quis tortor id nulla ultrices aliquet maecenas leo odio condimentum id luctus nec molestie,890,2023-09-21T16:43:45Z,1
375,71,Story,interdum mauris ullamcorper purus sit amet nulla quisque arcu libero rutrum ac lobortis vel dapibus at diam nam tristique tortor,71,2023-04-06T23:19:25Z,1
376,560,Story,eget vulputate ut ultrices vel augue vestibulum ante ipsum primis,360,2023-12-23T02:16:24Z,1
377,805,Story,mauris ullamcorper purus sit amet nulla quisque arcu libero rutrum ac lobortis vel dapibus at diam nam tristique,451,2023-11-07T19:18:03Z,1
378,770,Story,libero non mattis pulvinar nulla pede ullamcorper augue a suscipit nulla elit ac nulla sed vel,787,2023-05-24T17:53:36Z,1
379,334,Story,ut blandit non interdum in ante vestibulum ante ipsum primis in faucibus orci luctus et ultrices,670,2023-07-26T04:22:06Z,1
380,785,Story,orci luctus et ultrices posuere cubilia curae donec pharetra magna vestibulum aliquet ultrices erat,194,2023-12-07T07:03:24Z,1
381,204,Story,ac diam cras pellentesque volutpat dui maecenas tristique est et,989,2023-08-26T21:50:48Z,1
382,892,Story,faucibus cursus urna ut tellus nulla ut erat id mauris vulputate elementum nullam varius nulla,703,2023-12-07T15:15:08Z,1
383,551,Message,erat quisque erat eros viverra eget congue eget semper rutrum nulla nunc,880,2023-03-22T02:39:12Z,1
384,420,Story,nonummy integer non velit donec diam neque vestibulum eget vulputate ut ultrices vel augue vestibulum ante ipsum primis,959,2023-07-01T06:44:23Z,1
385,94,Story,ut massa volutpat convallis morbi odio odio elementum eu interdum,486,2023-10-17T16:54:31Z,1
386,710,Message,tortor id nulla ultrices aliquet maecenas leo odio condimentum id luctus,844,2023-05-13T10:41:52Z,1
387,343,Story,adipiscing elit proin risus praesent lectus vestibulum quam sapien varius ut blandit non interdum in ante vestibulum,387,2023-11-09T04:14:32Z,1
388,735,Story,lacinia erat vestibulum sed magna at nunc commodo placerat praesent,562,2023-09-24T15:42:49Z,1
389,920,Message,maecenas tristique est et tempus semper est quam pharetra magna ac consequat metus sapien ut nunc vestibulum ante,529,2023-06-19T23:19:57Z,1
390,838,Story,in libero ut massa volutpat convallis morbi odio odio elementum eu interdum eu,329,2023-07-28T12:17:43Z,1
391,401,Message,suscipit nulla elit ac nulla sed vel enim sit amet,951,2023-05-31T22:48:11Z,1
392,669,Message,pellentesque viverra pede ac diam cras pellentesque volutpat dui maecenas tristique est,686,2023-08-05T00:34:48Z,1
393,955,Story,praesent id massa id nisl venenatis lacinia aenean sit amet justo morbi ut odio cras mi pede malesuada in imperdiet,253,2023-09-16T06:00:37Z,1
394,228,Story,ligula suspendisse ornare consequat lectus in est risus auctor sed tristique in tempus sit amet sem fusce consequat,483,2023-12-06T13:25:43Z,1
395,289,Message,velit eu est congue elementum in hac habitasse platea dictumst morbi vestibulum velit id pretium iaculis diam erat fermentum,517,2023-10-13T17:59:24Z,1
396,732,Story,ut ultrices vel augue vestibulum ante ipsum primis in faucibus orci luctus et ultrices posuere cubilia curae donec pharetra magna,496,2023-03-23T21:54:04Z,1
397,501,Message,orci vehicula condimentum curabitur in libero ut massa volutpat convallis morbi odio odio elementum eu interdum eu tincidunt in,241,2023-04-29T03:41:05Z,1
398,878,Message,sapien quis libero nullam sit amet turpis elementum ligula vehicula consequat morbi a ipsum integer a,873,2024-02-01T15:44:27Z,1
399,739,Message,fringilla rhoncus mauris enim leo rhoncus sed vestibulum sit amet cursus id turpis integer aliquet massa,578,2023-05-07T14:46:37Z,1
400,527,Message,justo morbi ut odio cras mi pede malesuada in imperdiet et commodo vulputate,207,2023-11-15T23:29:40Z,1
401,375,Message,ultrices enim lorem ipsum dolor sit amet consectetuer adipiscing elit proin interdum mauris non ligula pellentesque,39,2023-05-12T02:21:58Z,1
402,53,Story,hac habitasse platea dictumst maecenas ut massa quis augue luctus tincidunt nulla mollis molestie lorem quisque,540,2023-05-08T05:08:04Z,1
403,335,Story,malesuada in imperdiet et commodo vulputate justo in blandit ultrices enim lorem ipsum dolor sit,730,2023-06-28T11:35:14Z,1
404,747,Story,at dolor quis odio consequat varius integer ac leo pellentesque ultrices mattis odio donec vitae,303,2023-08-31T20:47:53Z,1
405,618,Message,tortor risus dapibus augue vel accumsan tellus nisi eu orci mauris lacinia sapien quis libero nullam sit amet turpis elementum,845,2023-11-09T12:05:39Z,1
406,265,Message,semper interdum mauris ullamcorper purus sit amet nulla quisque arcu libero rutrum ac lobortis vel dapibus at,774,2023-04-22T14:38:37Z,1
407,420,Message,nibh in hac habitasse platea dictumst aliquam augue quam sollicitudin vitae consectetuer eget rutrum at lorem,424,2023-11-16T20:25:22Z,1
408,98,Message,tellus nisi eu orci mauris lacinia sapien quis libero nullam sit amet,373,2023-08-31T21:26:54Z,1
409,8,Story,magna vestibulum aliquet ultrices erat tortor sollicitudin mi sit amet lobortis sapien sapien non mi integer ac neque duis bibendum,191,2023-12-09T23:19:23Z,1
410,846,Story,odio curabitur convallis duis consequat dui nec nisi volutpat eleifend donec ut dolor morbi,667,2023-04-14T11:48:15Z,1
411,770,Story,bibendum imperdiet nullam orci pede venenatis non sodales sed tincidunt eu felis fusce,848,2023-12-01T07:58:15Z,1
412,538,Story,mattis pulvinar nulla pede ullamcorper augue a suscipit nulla elit ac nulla sed vel enim sit amet nunc viverra,6,2023-12-10T02:12:02Z,1
413,302,Story,in purus eu magna vulputate luctus cum sociis natoque penatibus et magnis dis parturient montes nascetur ridiculus,385,2023-11-11T16:29:34Z,1
414,600,Story,ac nibh fusce lacus purus aliquet at feugiat non pretium quis lectus suspendisse potenti in eleifend quam a odio,301,2023-09-01T08:22:12Z,1
415,808,Message,curabitur convallis duis consequat dui nec nisi volutpat eleifend donec ut dolor,961,2023-12-26T07:05:21Z,1
416,51,Story,parturient montes nascetur ridiculus mus vivamus vestibulum sagittis sapien cum sociis natoque penatibus et magnis dis parturient montes nascetur,930,2023-08-12T01:22:51Z,1
417,608,Story,neque sapien placerat ante nulla justo aliquam quis turpis eget elit sodales scelerisque,52,2024-01-03T07:08:05Z,1
418,557,Story,consequat morbi a ipsum integer a nibh in quis justo maecenas rhoncus aliquam,326,2023-12-19T20:31:34Z,1
419,722,Message,ultricies eu nibh quisque id justo sit amet sapien dignissim vestibulum vestibulum ante ipsum primis in,354,2023-05-21T05:02:19Z,1
420,397,Message,sed ante vivamus tortor duis mattis egestas metus aenean fermentum donec ut mauris eget massa,803,2023-10-15T22:55:48Z,1
421,358,Message,arcu sed augue aliquam erat volutpat in congue etiam justo etiam pretium,39,2023-08-01T19:46:12Z,1
422,473,Message,integer non velit donec diam neque vestibulum eget vulputate ut ultrices vel augue vestibulum ante ipsum primis in,456,2023-07-24T03:08:22Z,1
423,856,Story,sed magna at nunc commodo placerat praesent blandit nam nulla integer pede justo lacinia eget tincidunt eget tempus vel,463,2023-12-26T16:42:28Z,1
424,914,Story,odio condimentum id luctus nec molestie sed justo pellentesque viverra pede ac diam,71,2023-06-17T20:51:47Z,1
425,809,Story,vestibulum ante ipsum primis in faucibus orci luctus et ultrices posuere cubilia curae mauris viverra diam vitae quam suspendisse potenti,213,2023-03-10T04:49:49Z,1
426,283,Story,ac nibh fusce lacus purus aliquet at feugiat non pretium quis lectus suspendisse potenti,255,2023-09-22T08:04:55Z,1
427,427,Message,congue elementum in hac habitasse platea dictumst morbi vestibulum velit id,790,2023-08-06T10:39:32Z,1
428,150,Message,ultrices libero non mattis pulvinar nulla pede ullamcorper augue a suscipit,417,2023-11-27T19:42:36Z,1
429,104,Story,eget vulputate ut ultrices vel augue vestibulum ante ipsum primis in faucibus orci luctus et,244,2023-09-09T10:07:44Z,1
430,495,Story,suscipit a feugiat et eros vestibulum ac est lacinia nisi venenatis tristique fusce congue diam id,68,2023-07-07T05:27:01Z,1
431,194,Story,in blandit ultrices enim lorem ipsum dolor sit amet consectetuer adipiscing,471,2023-12-19T18:39:20Z,1
432,289,Message,erat tortor sollicitudin mi sit amet lobortis sapien sapien non mi integer ac neque duis bibendum morbi non quam nec,165,2023-12-30T06:06:11Z,1
433,299,Story,convallis nulla neque libero convallis eget eleifend luctus ultricies eu nibh,743,2023-10-08T07:48:51Z,1
434,840,Message,mattis egestas metus aenean fermentum donec ut mauris eget massa,217,2023-12-17T06:34:16Z,1
435,556,Message,duis ac nibh fusce lacus purus aliquet at feugiat non pretium quis lectus suspendisse,495,2023-03-22T07:25:48Z,1
436,437,Story,consequat varius integer ac leo pellentesque ultrices mattis odio donec vitae nisi,467,2024-02-06T13:56:42Z,1
437,516,Story,maecenas ut massa quis augue luctus tincidunt nulla mollis molestie lorem quisque ut,86,2023-11-12T11:03:28Z,1
438,238,Story,ut blandit non interdum in ante vestibulum ante ipsum primis in faucibus orci luctus et ultrices posuere,26,2024-02-24T13:55:13Z,1
439,511,Message,erat tortor sollicitudin mi sit amet lobortis sapien sapien non mi integer ac neque duis bibendum morbi non quam nec,224,2024-01-07T19:42:00Z,1
440,540,Message,vulputate justo in blandit ultrices enim lorem ipsum dolor sit amet,930,2024-02-20T20:34:21Z,1
441,421,Story,fusce consequat nulla nisl nunc nisl duis bibendum felis sed interdum venenatis turpis enim blandit mi,972,2023-07-23T21:52:55Z,1
442,277,Story,tempus vel pede morbi porttitor lorem id ligula suspendisse ornare consequat lectus,593,2023-10-01T17:40:18Z,1
443,167,Story,mauris viverra diam vitae quam suspendisse potenti nullam porttitor lacus at turpis donec posuere,169,2023-12-22T12:52:20Z,1
444,142,Message,fringilla rhoncus mauris enim leo rhoncus sed vestibulum sit amet cursus id turpis integer aliquet massa id,482,2023-10-29T15:53:36Z,1
445,815,Story,ut blandit non interdum in ante vestibulum ante ipsum primis in faucibus orci luctus et ultrices posuere cubilia curae duis,511,2023-09-29T12:12:50Z,1
446,838,Message,semper rutrum nulla nunc purus phasellus in felis donec semper sapien a libero nam dui proin,259,2023-03-09T14:25:39Z,1
447,852,Message,felis sed lacus morbi sem mauris laoreet ut rhoncus aliquet pulvinar sed nisl nunc rhoncus,902,2023-08-08T20:30:43Z,1
448,441,Message,non velit donec diam neque vestibulum eget vulputate ut ultrices vel augue vestibulum,128,2023-05-18T14:02:59Z,1
449,305,Message,a feugiat et eros vestibulum ac est lacinia nisi venenatis tristique fusce congue diam id ornare imperdiet sapien urna,101,2023-03-21T12:59:47Z,1
450,839,Story,praesent blandit nam nulla integer pede justo lacinia eget tincidunt eget tempus vel pede morbi porttitor,753,2024-01-10T18:42:01Z,1
451,952,Message,platea dictumst aliquam augue quam sollicitudin vitae consectetuer eget rutrum at lorem integer,113,2023-11-26T17:50:44Z,1
452,745,Message,vestibulum ante ipsum primis in faucibus orci luctus et ultrices posuere cubilia curae donec,866,2024-02-21T22:35:39Z,1
453,562,Message,fringilla rhoncus mauris enim leo rhoncus sed vestibulum sit amet cursus,952,2023-07-03T16:08:58Z,1
454,448,Story,et ultrices posuere cubilia curae duis faucibus accumsan odio curabitur convallis duis consequat dui nec nisi volutpat,481,2023-07-15T07:09:28Z,1
455,29,Message,dictumst etiam faucibus cursus urna ut tellus nulla ut erat id mauris vulputate elementum nullam,749,2023-11-12T20:24:51Z,1
456,888,Story,nam congue risus semper porta volutpat quam pede lobortis ligula sit amet eleifend pede libero quis orci nullam molestie nibh,20,2023-12-24T17:33:58Z,1
457,340,Story,nam dui proin leo odio porttitor id consequat in consequat ut nulla,325,2023-07-13T11:25:02Z,1
458,951,Message,leo odio condimentum id luctus nec molestie sed justo pellentesque viverra pede ac,536,2023-08-11T22:32:10Z,1
459,510,Message,posuere metus vitae ipsum aliquam non mauris morbi non lectus,702,2024-02-11T02:54:40Z,1
460,721,Message,et ultrices posuere cubilia curae duis faucibus accumsan odio curabitur convallis duis consequat dui nec nisi volutpat eleifend,842,2023-10-03T12:07:34Z,1
461,156,Story,quis odio consequat varius integer ac leo pellentesque ultrices mattis odio donec vitae nisi,636,2023-08-09T18:30:17Z,1
462,137,Message,consequat varius integer ac leo pellentesque ultrices mattis odio donec vitae nisi nam ultrices libero,211,2024-02-25T01:59:05Z,1
463,709,Story,tincidunt nulla mollis molestie lorem quisque ut erat curabitur gravida nisi at nibh in hac,895,2023-07-21T09:21:44Z,1
464,32,Story,tempor convallis nulla neque libero convallis eget eleifend luctus ultricies eu nibh quisque id justo sit amet sapien,158,2023-10-25T21:27:23Z,1
465,334,Story,eleifend quam a odio in hac habitasse platea dictumst maecenas ut massa quis augue luctus,749,2023-03-13T06:51:24Z,1
466,292,Message,volutpat convallis morbi odio odio elementum eu interdum eu tincidunt in leo maecenas pulvinar,151,2023-10-15T07:08:38Z,1
467,513,Story,turpis nec euismod scelerisque quam turpis adipiscing lorem vitae mattis,183,2023-11-24T10:05:41Z,1
468,688,Story,lacinia aenean sit amet justo morbi ut odio cras mi pede malesuada in imperdiet et,965,2023-05-28T07:20:38Z,1
469,64,Message,vivamus vel nulla eget eros elementum pellentesque quisque porta volutpat erat quisque erat eros viverra,921,2023-03-17T08:10:44Z,1
470,876,Message,sed justo pellentesque viverra pede ac diam cras pellentesque volutpat dui,273,2023-04-23T09:37:07Z,1
471,833,Story,amet eros suspendisse accumsan tortor quis turpis sed ante vivamus tortor duis,752,2023-10-17T07:31:42Z,1
472,218,Story,ut ultrices vel augue vestibulum ante ipsum primis in faucibus orci luctus et ultrices,963,2023-11-27T18:27:27Z,1
473,436,Story,tincidunt in leo maecenas pulvinar lobortis est phasellus sit amet erat nulla tempus vivamus in,267,2024-02-12T02:11:52Z,1
474,420,Message,condimentum neque sapien placerat ante nulla justo aliquam quis turpis eget,13,2023-04-19T05:46:09Z,1
475,113,Story,posuere cubilia curae nulla dapibus dolor vel est donec odio justo sollicitudin ut suscipit a feugiat et eros vestibulum ac,25,2024-01-30T09:18:21Z,1
476,439,Story,non lectus aliquam sit amet diam in magna bibendum imperdiet nullam orci pede,426,2023-04-07T13:01:53Z,1
477,467,Message,ipsum integer a nibh in quis justo maecenas rhoncus aliquam lacus morbi quis tortor id nulla ultrices aliquet maecenas,239,2023-03-29T23:36:16Z,1
478,525,Story,justo nec condimentum neque sapien placerat ante nulla justo aliquam quis turpis eget elit sodales,861,2023-07-14T21:18:47Z,1
479,464,Message,velit vivamus vel nulla eget eros elementum pellentesque quisque porta volutpat erat quisque erat eros viverra eget,5,2023-06-04T13:20:25Z,1
480,835,Story,nullam sit amet turpis elementum ligula vehicula consequat morbi a ipsum integer a nibh in,914,2023-10-09T21:20:46Z,1
481,590,Story,felis fusce posuere felis sed lacus morbi sem mauris laoreet ut,492,2023-03-22T04:43:38Z,1
482,351,Message,proin interdum mauris non ligula pellentesque ultrices phasellus id sapien in sapien iaculis congue vivamus,468,2023-12-28T04:44:53Z,1
483,124,Message,libero nam dui proin leo odio porttitor id consequat in consequat ut,911,2023-08-24T14:27:05Z,1
484,914,Message,in est risus auctor sed tristique in tempus sit amet,72,2023-10-09T15:37:01Z,1
485,319,Story,eros elementum pellentesque quisque porta volutpat erat quisque erat eros viverra eget congue eget semper rutrum,483,2023-08-25T22:35:01Z,1
486,151,Story,elit ac nulla sed vel enim sit amet nunc viverra,410,2023-07-23T11:15:32Z,1
487,449,Message,vestibulum sed magna at nunc commodo placerat praesent blandit nam nulla integer pede,775,2023-10-27T02:57:05Z,1
488,711,Message,justo lacinia eget tincidunt eget tempus vel pede morbi porttitor lorem id ligula suspendisse ornare consequat lectus,916,2024-02-23T15:54:30Z,1
489,483,Story,luctus et ultrices posuere cubilia curae mauris viverra diam vitae quam suspendisse potenti nullam porttitor lacus at turpis donec posuere,956,2023-10-24T13:21:37Z,1
490,392,Story,et ultrices posuere cubilia curae donec pharetra magna vestibulum aliquet ultrices erat tortor sollicitudin mi sit amet,952,2023-11-13T15:58:21Z,1
491,628,Story,platea dictumst aliquam augue quam sollicitudin vitae consectetuer eget rutrum at lorem,570,2023-11-08T06:09:10Z,1
492,37,Story,in lacus curabitur at ipsum ac tellus semper interdum mauris,35,2023-12-07T09:16:40Z,1
493,186,Story,nonummy integer non velit donec diam neque vestibulum eget vulputate ut ultrices,350,2023-02-28T09:58:38Z,1
494,677,Story,cubilia curae duis faucibus accumsan odio curabitur convallis duis consequat dui nec nisi volutpat eleifend,427,2023-12-28T11:02:11Z,1
495,915,Message,congue etiam justo etiam pretium iaculis justo in hac habitasse platea dictumst,724,2023-09-03T14:06:38Z,1
496,471,Story,eu felis fusce posuere felis sed lacus morbi sem mauris laoreet ut rhoncus aliquet pulvinar sed,946,2023-07-09T21:54:33Z,1
497,70,Message,nunc donec quis orci eget orci vehicula condimentum curabitur in libero ut massa volutpat convallis morbi odio odio elementum,897,2023-10-24T04:33:32Z,1
498,659,Story,aliquam augue quam sollicitudin vitae consectetuer eget rutrum at lorem integer tincidunt ante vel ipsum praesent blandit lacinia erat vestibulum,731,2024-01-15T05:20:15Z,1
499,835,Message,tincidunt in leo maecenas pulvinar lobortis est phasellus sit amet erat nulla tempus,503,2023-03-25T17:56:10Z,1
500,889,Story,vehicula condimentum curabitur in libero ut massa volutpat convallis morbi odio odio elementum eu interdum eu,65,2023-10-28T21:19:40Z,1
501,778,Story,aenean lectus pellentesque eget nunc donec quis orci eget orci vehicula condimentum curabitur in libero,200,2023-12-28T20:51:46Z,1
502,683,Message,eu mi nulla ac enim in tempor turpis nec euismod scelerisque quam turpis adipiscing lorem vitae mattis nibh,589,2023-11-28T14:29:43Z,1
503,806,Story,nam nulla integer pede justo lacinia eget tincidunt eget tempus vel,776,2023-04-01T10:57:44Z,1
504,764,Story,pellentesque viverra pede ac diam cras pellentesque volutpat dui maecenas tristique est et tempus semper est quam pharetra magna ac,650,2023-05-14T13:02:19Z,1
505,891,Message,sed justo pellentesque viverra pede ac diam cras pellentesque volutpat dui maecenas tristique est et tempus semper est quam,821,2023-10-07T08:56:38Z,1
506,92,Message,morbi a ipsum integer a nibh in quis justo maecenas rhoncus,387,2023-11-08T15:10:40Z,1
507,912,Story,montes nascetur ridiculus mus etiam vel augue vestibulum rutrum rutrum neque aenean auctor gravida sem,29,2023-06-04T03:02:46Z,1
508,79,Message,a ipsum integer a nibh in quis justo maecenas rhoncus aliquam lacus,25,2023-03-08T23:48:37Z,1
509,785,Story,blandit lacinia erat vestibulum sed magna at nunc commodo placerat praesent blandit nam nulla integer pede justo lacinia eget tincidunt,581,2023-11-06T10:28:58Z,1
510,132,Message,et ultrices posuere cubilia curae duis faucibus accumsan odio curabitur convallis duis consequat dui,571,2023-06-06T18:05:46Z,1
511,620,Story,eget nunc donec quis orci eget orci vehicula condimentum curabitur in libero ut massa volutpat convallis morbi odio odio elementum,75,2023-07-18T09:45:15Z,1
512,198,Message,ante vel ipsum praesent blandit lacinia erat vestibulum sed magna at nunc commodo placerat praesent blandit nam nulla,919,2023-04-06T08:22:25Z,1
513,11,Story,et ultrices posuere cubilia curae mauris viverra diam vitae quam suspendisse potenti nullam porttitor,747,2023-11-06T14:51:58Z,1
514,225,Story,nulla pede ullamcorper augue a suscipit nulla elit ac nulla sed vel enim sit,519,2023-08-29T00:28:05Z,1
515,633,Message,libero ut massa volutpat convallis morbi odio odio elementum eu,668,2023-07-05T19:39:31Z,1
516,990,Message,nullam molestie nibh in lectus pellentesque at nulla suspendisse potenti cras in purus eu magna vulputate luctus cum,726,2024-01-04T07:21:49Z,1
517,268,Story,sit amet nunc viverra dapibus nulla suscipit ligula in lacus curabitur,731,2023-12-19T22:13:32Z,1
518,446,Message,orci mauris lacinia sapien quis libero nullam sit amet turpis,976,2023-06-15T14:50:28Z,1
519,192,Story,vivamus vel nulla eget eros elementum pellentesque quisque porta volutpat,236,2023-07-23T21:33:36Z,1
520,353,Story,vivamus vel nulla eget eros elementum pellentesque quisque porta volutpat erat quisque erat eros viverra eget congue eget semper rutrum,669,2023-06-15T11:50:14Z,1
521,921,Message,at turpis a pede posuere nonummy integer non velit donec diam neque vestibulum eget vulputate ut,814,2024-01-06T06:54:08Z,1
522,657,Message,semper rutrum nulla nunc purus phasellus in felis donec semper sapien a libero nam dui proin,103,2023-12-25T03:50:12Z,1
523,757,Story,imperdiet nullam orci pede venenatis non sodales sed tincidunt eu felis,776,2023-06-09T15:01:23Z,1
524,749,Story,duis ac nibh fusce lacus purus aliquet at feugiat non pretium quis lectus suspendisse potenti in,853,2023-10-28T10:35:02Z,1
525,931,Message,justo in hac habitasse platea dictumst etiam faucibus cursus urna ut tellus nulla,193,2023-08-11T15:37:23Z,1
526,328,Message,non velit nec nisi vulputate nonummy maecenas tincidunt lacus at velit vivamus vel nulla eget eros elementum,948,2023-09-14T13:33:22Z,1
527,811,Story,odio odio elementum eu interdum eu tincidunt in leo maecenas pulvinar,292,2023-11-01T12:53:57Z,1
528,422,Story,volutpat erat quisque erat eros viverra eget congue eget semper rutrum nulla nunc,811,2023-09-27T08:07:37Z,1
529,411,Message,sit amet consectetuer adipiscing elit proin interdum mauris non ligula pellentesque ultrices phasellus,889,2023-04-16T13:25:52Z,1
530,121,Story,et magnis dis parturient montes nascetur ridiculus mus etiam vel,874,2023-04-18T11:30:27Z,1
531,503,Story,amet turpis elementum ligula vehicula consequat morbi a ipsum integer a nibh in quis justo maecenas rhoncus,371,2024-02-10T11:09:59Z,1
532,498,Message,tempus sit amet sem fusce consequat nulla nisl nunc nisl duis bibendum felis sed interdum venenatis turpis enim,505,2023-12-20T22:25:24Z,1
533,600,Message,ante ipsum primis in faucibus orci luctus et ultrices posuere cubilia curae mauris viverra diam vitae,600,2023-04-16T09:59:53Z,1
534,371,Story,nulla facilisi cras non velit nec nisi vulputate nonummy maecenas tincidunt lacus at velit vivamus vel nulla,202,2024-02-10T08:27:48Z,1
535,261,Message,sagittis dui vel nisl duis ac nibh fusce lacus purus aliquet at feugiat non pretium,602,2023-05-23T05:42:46Z,1
536,753,Message,vivamus in felis eu sapien cursus vestibulum proin eu mi nulla ac enim in tempor,167,2023-04-22T21:41:44Z,1
537,503,Message,congue etiam justo etiam pretium iaculis justo in hac habitasse platea dictumst etiam faucibus cursus urna ut,498,2023-09-22T04:46:30Z,1
538,933,Story,orci pede venenatis non sodales sed tincidunt eu felis fusce posuere,326,2023-07-06T20:28:14Z,1
539,320,Message,ipsum primis in faucibus orci luctus et ultrices posuere cubilia curae mauris viverra diam vitae quam suspendisse potenti nullam,201,2023-09-19T08:58:58Z,1
540,117,Message,ac est lacinia nisi venenatis tristique fusce congue diam id ornare,637,2023-04-27T02:07:47Z,1
541,596,Message,sapien quis libero nullam sit amet turpis elementum ligula vehicula consequat morbi a ipsum,340,2023-11-12T03:31:30Z,1
542,37,Message,tincidunt nulla mollis molestie lorem quisque ut erat curabitur gravida nisi at nibh in hac,564,2023-05-13T23:17:09Z,1
543,202,Message,pharetra magna ac consequat metus sapien ut nunc vestibulum ante,108,2023-12-25T12:20:21Z,1
544,252,Story,metus aenean fermentum donec ut mauris eget massa tempor convallis nulla neque libero convallis,835,2023-07-07T08:05:17Z,1
545,86,Message,turpis donec posuere metus vitae ipsum aliquam non mauris morbi non lectus aliquam,390,2023-09-13T04:33:42Z,1
546,194,Message,felis sed lacus morbi sem mauris laoreet ut rhoncus aliquet pulvinar sed nisl nunc rhoncus dui vel sem sed,175,2023-05-12T08:55:42Z,1
547,64,Message,morbi non lectus aliquam sit amet diam in magna bibendum imperdiet nullam orci pede venenatis non sodales sed tincidunt eu,815,2023-11-15T01:05:30Z,1
548,729,Story,et commodo vulputate justo in blandit ultrices enim lorem ipsum dolor sit amet consectetuer adipiscing elit proin interdum mauris,438,2023-12-16T16:59:23Z,1
549,773,Message,non pretium quis lectus suspendisse potenti in eleifend quam a odio in hac habitasse,604,2023-07-02T13:12:48Z,1
550,606,Story,ipsum primis in faucibus orci luctus et ultrices posuere cubilia curae duis faucibus accumsan,629,2023-09-18T11:30:35Z,1
551,482,Story,lacinia aenean sit amet justo morbi ut odio cras mi pede malesuada in imperdiet et commodo vulputate justo in,817,2023-03-28T22:55:43Z,1
552,99,Story,in eleifend quam a odio in hac habitasse platea dictumst maecenas ut massa quis augue luctus tincidunt,939,2024-02-19T18:33:07Z,1
553,902,Message,aliquet pulvinar sed nisl nunc rhoncus dui vel sem sed sagittis nam congue risus semper porta volutpat quam pede,61,2023-12-21T04:19:55Z,1
554,507,Message,consectetuer adipiscing elit proin risus praesent lectus vestibulum quam sapien varius ut blandit non,159,2023-06-04T08:51:37Z,1
555,222,Message,posuere cubilia curae donec pharetra magna vestibulum aliquet ultrices erat tortor sollicitudin mi sit amet lobortis sapien sapien non mi,555,2024-01-22T01:35:11Z,1
556,818,Message,vel nulla eget eros elementum pellentesque quisque porta volutpat erat quisque,9,2023-07-28T13:06:13Z,1
