id,user_id,post_type,content,recipient_id,created_at,is_visible
184,615,Story,ut massa quis augue luctus tincidunt nulla mollis molestie lorem quisque ut erat curabitur,679,2023-09-11T13:27:00Z,1
185,983,Story,mi sit amet lobortis sapien sapien non mi integer ac neque duis bibendum,456,2023-07-16T22:26:40Z,1
186,442,Story,tincidunt lacus at velit vivamus vel nulla eget eros elementum pellentesque quisque porta volutpat erat quisque erat eros,237,2023-08-01T00:37:45Z,1
187,524,Story,aliquet massa id lobortis convallis tortor risus dapibus augue vel accumsan tellus,935,2023-04-30T17:21:35Z,1
188,290,Message,sem praesent id massa id nisl venenatis lacinia aenean sit amet justo morbi ut odio cras mi,688,2024-01-28T09:49:15Z,1
189,419,Message,congue eget semper rutrum nulla nunc purus phasellus in felis donec semper sapien,205,2023-03-29T18:26:08Z,1
190,208,Message,lacus at velit vivamus vel nulla eget eros elementum pellentesque quisque porta volutpat erat quisque erat eros,487,2024-01-03T10:15:41Z,1
191,991,Message,donec posuere metus vitae ipsum aliquam non mauris morbi non lectus aliquam,432,2023-05-18T11:46:27Z,1
192,243,Story,amet lobortis sapien sapien non mi integer ac neque duis,88,2023-08-11T09:23:35Z,1
193,760,Story,semper interdum mauris ullamcorper purus sit amet nulla quisque arcu,15,2023-12-12T05:09:21Z,1
194,570,Message,porttitor lorem id ligula suspendisse ornare consequat lectus in est risus auctor sed tristique,734,2023-03-28T14:08:15Z,1
195,393,Story,praesent blandit lacinia erat vestibulum sed magna at nunc commodo placerat,970,2023-04-26T15:53:23Z,1
196,188,Message,pharetra magna ac consequat metus sapien ut nunc vestibulum ante ipsum primis,350,2023-03-09T10:48:02Z,1
197,784,Story,penatibus et magnis dis parturient montes nascetur ridiculus mus etiam vel augue vestibulum rutrum rutrum neque aenean,561,2023-09-16T02:52:08Z,1
198,344,Story,elit sodales scelerisque mauris sit amet eros suspendisse accumsan tortor quis turpis sed ante vivamus tortor,446,2023-06-05T16:03:13Z,1
199,394,Message,nulla tellus in sagittis dui vel nisl duis ac nibh fusce lacus purus aliquet,846,2023-05-21T04:56:43Z,1
200,382,Message,nam nulla integer pede justo lacinia eget tincidunt eget tempus vel,208,2023-08-02T16:20:06Z,1
201,473,Story,sagittis nam congue risus semper porta volutpat quam pede lobortis ligula sit amet eleifend pede libero,751,2023-06-17T09:50:20Z,1
202,7,Story,a odio in hac habitasse platea dictumst maecenas ut massa quis augue luctus tincidunt nulla mollis molestie lorem quisque ut,162,2023-09-03T15:22:36Z,1
203,487,Message,leo odio porttitor id consequat in consequat ut nulla sed accumsan felis ut at dolor quis odio consequat varius integer,401,2023-02-25T05:26:05Z,1
204,342,Message,potenti cras in purus eu magna vulputate luctus cum sociis natoque penatibus et magnis dis,870,2023-08-22T01:48:13Z,1
205,217,Message,nisi at nibh in hac habitasse platea dictumst aliquam augue,668,2023-04-18T20:04:14Z,1
206,920,Story,elit proin interdum mauris non ligula pellentesque ultrices phasellus id sapien in sapien iaculis congue vivamus metus arcu,268,2023-04-25T07:20:26Z,1
207,524,Story,augue vel accumsan tellus nisi eu orci mauris lacinia sapien,408,2023-03-23T06:21:19Z,1
208,339,Story,in blandit ultrices enim lorem ipsum dolor sit amet consectetuer adipiscing,150,2023-03-24T19:11:44Z,1
209,389,Story,varius nulla facilisi cras non velit nec nisi vulputate nonummy maecenas tincidunt lacus at velit vivamus vel nulla,147,2023-07-07T23:17:18Z,1
210,272,Message,interdum mauris non ligula pellentesque ultrices phasellus id sapien in,451,2023-12-10T04:48:51Z,1
211,870,Story,scelerisque quam turpis adipiscing lorem vitae mattis nibh ligula nec sem duis aliquam convallis,250,2023-05-03T14:20:29Z,1
212,88,Message,sapien iaculis congue vivamus metus arcu adipiscing molestie hendrerit at vulputate vitae nisl,467,2023-04-14T01:12:39Z,1
213,591,Message,nullam porttitor lacus at turpis donec posuere metus vitae ipsum aliquam non,613,2023-03-18T01:52:15Z,1
214,29,Story,magna ac consequat metus sapien ut nunc vestibulum ante ipsum primis in faucibus orci,969,2023-08-13T07:18:11Z,1
215,797,Story,diam id ornare imperdiet sapien urna pretium nisl ut volutpat sapien arcu,892,2023-09-11T23:47:25Z,1
216,842,Message,luctus cum sociis natoque penatibus et magnis dis parturient montes nascetur ridiculus mus vivamus,902,2023-04-30T18:44:26Z,1
217,247,Story,quis tortor id nulla ultrices aliquet maecenas leo odio condimentum id,289,2023-04-21T23:43:13Z,1
218,768,Message,ut massa quis augue luctus tincidunt nulla mollis molestie lorem quisque ut erat curabitur gravida nisi at nibh,233,2023-09-21T23:09:35Z,1
219,11,Story,potenti nullam porttitor lacus at turpis donec posuere metus vitae ipsum aliquam non mauris morbi non,82,2023-12-12T01:31:47Z,1
220,462,Message,ante vestibulum ante ipsum primis in faucibus orci luctus et ultrices posuere cubilia curae duis faucibus accumsan odio curabitur convallis,793,2023-10-30T21:47:59Z,1
221,624,Message,habitasse platea dictumst maecenas ut massa quis augue luctus tincidunt nulla mollis molestie lorem quisque ut erat,957,2024-01-17T08:18:17Z,1
222,704,Message,risus semper porta volutpat quam pede lobortis ligula sit amet eleifend pede libero quis orci,240,2023-08-17T14:26:57Z,1
223,121,Story,luctus et ultrices posuere cubilia curae donec pharetra magna vestibulum aliquet ultrices,435,2023-07-03T02:16:07Z,1
224,745,Message,praesent blandit nam nulla integer pede justo lacinia eget tincidunt eget tempus vel pede morbi porttitor,295,2023-08-18T05:38:07Z,1
225,714,Story,neque sapien placerat ante nulla justo aliquam quis turpis eget elit sodales scelerisque mauris sit amet eros suspendisse accumsan tortor,553,2023-07-16T03:42:35Z,1
226,935,Message,posuere cubilia curae mauris viverra diam vitae quam suspendisse potenti nullam porttitor lacus,888,2024-02-14T22:31:13Z,1
227,234,Story,donec diam neque vestibulum eget vulputate ut ultrices vel augue,510,2023-05-20T12:14:42Z,1
228,540,Story,mauris viverra diam vitae quam suspendisse potenti nullam porttitor lacus at turpis donec posuere metus vitae ipsum,506,2023-08-13T06:56:06Z,1
229,247,Story,erat fermentum justo nec condimentum neque sapien placerat ante nulla justo,29,2023-10-27T00:36:08Z,1
230,608,Story,mattis odio donec vitae nisi nam ultrices libero non mattis pulvinar nulla,931,2023-04-22T05:34:11Z,1
231,898,Story,felis ut at dolor quis odio consequat varius integer ac leo pellentesque ultrices mattis odio donec vitae nisi,335,2024-01-27T22:35:13Z,1
232,747,Message,erat curabitur gravida nisi at nibh in hac habitasse platea dictumst,103,2024-01-29T10:35:45Z,1
233,7,Message,parturient montes nascetur ridiculus mus etiam vel augue vestibulum rutrum rutrum neque aenean auctor gravida,79,2023-04-16T19:22:36Z,1
234,711,Message,at velit vivamus vel nulla eget eros elementum pellentesque quisque porta volutpat erat quisque erat eros viverra eget congue eget,943,2023-06-24T08:40:04Z,1
235,650,Story,iaculis diam erat fermentum justo nec condimentum neque sapien placerat ante nulla justo aliquam quis turpis eget elit sodales,629,2023-03-30T19:42:15Z,1
236,59,Story,blandit ultrices enim lorem ipsum dolor sit amet consectetuer adipiscing elit proin interdum mauris non ligula pellentesque,14,2023-10-16T19:17:22Z,1
237,585,Message,ultrices libero non mattis pulvinar nulla pede ullamcorper augue a suscipit nulla elit ac nulla sed vel,712,2023-08-14T09:49:53Z,1
238,328,Story,etiam faucibus cursus urna ut tellus nulla ut erat id mauris vulputate elementum nullam varius nulla facilisi cras,707,2024-01-27T09:44:16Z,1
239,945,Message,eget congue eget semper rutrum nulla nunc purus phasellus in felis donec semper sapien a libero nam dui proin leo,381,2023-04-15T04:09:34Z,1
240,982,Message,elementum nullam varius nulla facilisi cras non velit nec nisi vulputate nonummy maecenas tincidunt lacus at velit vivamus vel nulla,178,2023-12-31T01:42:43Z,1
241,897,Story,convallis morbi odio odio elementum eu interdum eu tincidunt in leo maecenas pulvinar,742,2023-06-21T08:30:49Z,1
242,151,Story,scelerisque quam turpis adipiscing lorem vitae mattis nibh ligula nec sem duis aliquam convallis,688,2024-02-15T16:05:08Z,1
243,788,Story,in sagittis dui vel nisl duis ac nibh fusce lacus,689,2023-06-19T06:30:14Z,1
244,528,Message,leo pellentesque ultrices mattis odio donec vitae nisi nam ultrices libero non mattis,738,2023-04-30T04:45:44Z,1
245,652,Story,donec pharetra magna vestibulum aliquet ultrices erat tortor sollicitudin mi sit amet lobortis,137,2024-01-09T23:40:21Z,1
246,83,Message,vel ipsum praesent blandit lacinia erat vestibulum sed magna at nunc commodo placerat praesent blandit nam nulla integer pede justo,794,2024-02-10T18:40:43Z,1
247,774,Story,dolor sit amet consectetuer adipiscing elit proin risus praesent lectus vestibulum quam sapien varius ut blandit non interdum,3,2023-04-16T09:01:16Z,1
248,91,Message,id ligula suspendisse ornare consequat lectus in est risus auctor sed tristique in tempus sit amet sem,695,2023-10-16T02:12:51Z,1
249,6,Message,felis donec semper sapien a libero nam dui proin leo odio porttitor id consequat in consequat ut nulla sed,340,2024-02-23T10:40:37Z,1
250,334,Message,mi pede malesuada in imperdiet et commodo vulputate justo in blandit ultrices enim lorem,650,2023-07-06T02:26:32Z,1
251,857,Message,natoque penatibus et magnis dis parturient montes nascetur ridiculus mus vivamus vestibulum sagittis sapien cum sociis natoque penatibus et,811,2023-10-15T09:02:14Z,1
252,155,Message,eget eleifend luctus ultricies eu nibh quisque id justo sit amet sapien dignissim vestibulum vestibulum,67,2023-11-21T15:38:44Z,1
253,523,Message,venenatis lacinia aenean sit amet justo morbi ut odio cras mi pede malesuada in imperdiet,441,2023-12-25T20:56:28Z,1
254,11,Story,lorem vitae mattis nibh ligula nec sem duis aliquam convallis nunc proin at turpis a pede,333,2023-06-26T12:51:08Z,1
255,316,Message,id ornare imperdiet sapien urna pretium nisl ut volutpat sapien arcu sed augue aliquam erat,970,2023-12-20T01:06:52Z,1
256,169,Message,montes nascetur ridiculus mus etiam vel augue vestibulum rutrum rutrum,369,2023-03-28T10:39:05Z,1
257,188,Message,mattis pulvinar nulla pede ullamcorper augue a suscipit nulla elit ac nulla sed,268,2023-07-24T07:38:36Z,1
258,242,Message,ipsum dolor sit amet consectetuer adipiscing elit proin interdum mauris non ligula pellentesque ultrices phasellus id,33,2023-10-18T05:25:59Z,1
259,390,Story,habitasse platea dictumst maecenas ut massa quis augue luctus tincidunt nulla mollis molestie lorem quisque ut erat,501,2023-03-13T15:05:37Z,1
260,383,Story,fermentum justo nec condimentum neque sapien placerat ante nulla justo aliquam quis turpis eget elit,77,2024-01-22T01:14:32Z,1
261,565,Message,quisque ut erat curabitur gravida nisi at nibh in hac habitasse platea dictumst,89,2023-12-14T14:45:23Z,1
262,408,Story,primis in faucibus orci luctus et ultrices posuere cubilia curae mauris viverra diam vitae quam suspendisse potenti nullam porttitor,729,2024-01-22T20:46:17Z,1
263,306,Story,non velit nec nisi vulputate nonummy maecenas tincidunt lacus at velit,240,2023-10-29T13:46:49Z,1
264,566,Story,justo nec condimentum neque sapien placerat ante nulla justo aliquam quis turpis eget elit sodales scelerisque mauris sit,849,2023-07-12T14:46:54Z,1
265,863,Message,quisque id justo sit amet sapien dignissim vestibulum vestibulum ante ipsum primis in faucibus orci luctus et ultrices posuere cubilia,383,2023-11-06T14:35:03Z,1
266,414,Story,sed ante vivamus tortor duis mattis egestas metus aenean fermentum donec ut mauris eget massa tempor convallis nulla,657,2023-05-22T03:17:54Z,1
267,762,Story,id ornare imperdiet sapien urna pretium nisl ut volutpat sapien arcu sed augue aliquam erat,140,2024-01-04T15:47:16Z,1
268,616,Story,elit ac nulla sed vel enim sit amet nunc viverra,681,2024-01-10T16:25:20Z,1
269,573,Story,ut blandit non interdum in ante vestibulum ante ipsum primis in,901,2023-07-30T03:37:32Z,1
270,859,Message,vel augue vestibulum rutrum rutrum neque aenean auctor gravida sem,248,2023-03-01T05:58:18Z,1
271,648,Story,lorem ipsum dolor sit amet consectetuer adipiscing elit proin interdum,241,2023-06-03T01:57:17Z,1
272,673,Story,proin interdum mauris non ligula pellentesque ultrices phasellus id sapien in sapien iaculis congue vivamus metus arcu,430,2023-05-29T04:15:46Z,1
273,585,Story,integer non velit donec diam neque vestibulum eget vulputate ut ultrices,755,2023-07-07T01:04:11Z,1
274,592,Message,quis turpis sed ante vivamus tortor duis mattis egestas metus aenean,732,2023-08-02T23:34:41Z,1
275,831,Message,id luctus nec molestie sed justo pellentesque viverra pede ac diam cras pellentesque,869,2023-11-06T09:50:10Z,1
276,926,Story,pretium iaculis justo in hac habitasse platea dictumst etiam faucibus cursus,55,2024-02-06T01:09:00Z,1
277,793,Message,vestibulum ante ipsum primis in faucibus orci luctus et ultrices posuere cubilia,58,2023-10-02T22:29:41Z,1
278,700,Story,ut dolor morbi vel lectus in quam fringilla rhoncus mauris enim leo rhoncus sed vestibulum sit amet cursus id,910,2023-12-15T09:21:38Z,1
279,665,Message,interdum mauris ullamcorper purus sit amet nulla quisque arcu libero,209,2023-05-30T11:29:49Z,1
280,144,Story,nullam orci pede venenatis non sodales sed tincidunt eu felis fusce posuere felis sed lacus morbi sem mauris,456,2023-03-17T05:04:24Z,1
281,71,Story,consequat nulla nisl nunc nisl duis bibendum felis sed interdum venenatis turpis enim blandit,578,2023-10-03T15:44:38Z,1
282,887,Message,rhoncus mauris enim leo rhoncus sed vestibulum sit amet cursus id turpis integer aliquet,232,2023-03-30T23:25:01Z,1
283,233,Message,tempus semper est quam pharetra magna ac consequat metus sapien ut nunc vestibulum ante ipsum primis in faucibus orci luctus,561,2023-11-30T17:57:56Z,1
284,291,Story,sed vel enim sit amet nunc viverra dapibus nulla suscipit,502,2023-07-15T07:36:55Z,1
285,867,Message,primis in faucibus orci luctus et ultrices posuere cubilia curae duis faucibus accumsan odio curabitur convallis duis consequat dui nec,193,2023-09-18T19:42:47Z,1
286,416,Story,mauris sit amet eros suspendisse accumsan tortor quis turpis sed ante vivamus tortor,215,2023-08-16T18:40:27Z,1
287,672,Story,sapien cum sociis natoque penatibus et magnis dis parturient montes,255,2023-10-11T19:55:31Z,1
288,659,Story,gravida sem praesent id massa id nisl venenatis lacinia aenean sit amet justo morbi ut,739,2023-07-05T01:04:36Z,1
289,428,Message,duis bibendum felis sed interdum venenatis turpis enim blandit mi,329,2023-07-17T16:58:43Z,1
290,181,Story,amet diam in magna bibendum imperdiet nullam orci pede venenatis non sodales sed tincidunt eu felis fusce posuere felis sed,924,2023-12-05T11:32:13Z,1
291,679,Story,consequat varius integer ac leo pellentesque ultrices mattis odio donec vitae nisi nam ultrices libero non,786,2023-06-12T08:02:21Z,1
292,345,Story,nullam orci pede venenatis non sodales sed tincidunt eu felis fusce posuere felis sed lacus,328,2023-06-14T00:38:34Z,1
293,997,Story,ipsum primis in faucibus orci luctus et ultrices posuere cubilia curae nulla dapibus dolor vel est donec odio justo sollicitudin,581,2023-10-07T17:28:32Z,1
294,429,Story,neque vestibulum eget vulputate ut ultrices vel augue vestibulum ante ipsum primis in faucibus orci,342,2023-04-21T12:23:26Z,1
295,134,Message,primis in faucibus orci luctus et ultrices posuere cubilia curae duis faucibus accumsan odio curabitur convallis duis consequat,584,2023-11-29T08:45:13Z,1
296,757,Story,posuere cubilia curae nulla dapibus dolor vel est donec odio justo sollicitudin ut suscipit a feugiat et eros vestibulum ac,248,2023-11-12T00:44:21Z,1
297,376,Message,ut mauris eget massa tempor convallis nulla neque libero convallis eget eleifend,543,2024-02-02T12:13:10Z,1
298,402,Message,lectus aliquam sit amet diam in magna bibendum imperdiet nullam orci pede venenatis non,157,2023-09-01T07:30:28Z,1
299,134,Story,libero nam dui proin leo odio porttitor id consequat in consequat,177,2023-08-06T23:39:10Z,1
300,10,Story,velit eu est congue elementum in hac habitasse platea dictumst morbi vestibulum velit id pretium iaculis diam,914,2023-04-01T00:07:17Z,1
301,122,Message,nascetur ridiculus mus vivamus vestibulum sagittis sapien cum sociis natoque penatibus et magnis dis parturient montes nascetur,516,2023-11-17T13:16:44Z,1
302,481,Message,eget massa tempor convallis nulla neque libero convallis eget eleifend luctus ultricies eu nibh quisque,414,2024-02-06T20:56:39Z,1
303,819,Story,eu mi nulla ac enim in tempor turpis nec euismod,14,2023-08-21T01:18:32Z,1
304,839,Message,sapien arcu sed augue aliquam erat volutpat in congue etiam justo etiam pretium iaculis justo in,122,2023-11-07T11:18:03Z,1
305,215,Message,vitae quam suspendisse potenti nullam porttitor lacus at turpis donec posuere metus vitae ipsum aliquam non mauris morbi non,26,2023-03-03T17:08:12Z,1
306,126,Story,mi integer ac neque duis bibendum morbi non quam nec dui luctus rutrum nulla tellus in,159,2023-05-25T02:36:53Z,1
307,245,Message,diam neque vestibulum eget vulputate ut ultrices vel augue vestibulum ante ipsum primis,759,2023-09-03T23:44:25Z,1
308,670,Story,cubilia curae mauris viverra diam vitae quam suspendisse potenti nullam porttitor lacus at turpis donec posuere metus vitae,216,2024-02-07T03:44:38Z,1
309,521,Message,tincidunt nulla mollis molestie lorem quisque ut erat curabitur gravida nisi at nibh in hac habitasse platea,783,2023-06-23T23:57:07Z,1
310,815,Message,suscipit nulla elit ac nulla sed vel enim sit amet nunc,182,2023-12-31T03:32:26Z,1
311,76,Story,nonummy integer non velit donec diam neque vestibulum eget vulputate ut ultrices vel augue vestibulum ante ipsum primis,990,2023-04-05T02:27:45Z,1
312,687,Story,eget congue eget semper rutrum nulla nunc purus phasellus in felis donec semper sapien a libero,676,2023-10-04T19:31:27Z,1
313,439,Message,aliquet massa id lobortis convallis tortor risus dapibus augue vel accumsan tellus nisi eu,54,2023-04-06T10:36:38Z,1
314,3,Message,cum sociis natoque penatibus et magnis dis parturient montes nascetur ridiculus mus vivamus vestibulum,446,2023-05-30T05:20:57Z,1
315,215,Message,id ligula suspendisse ornare consequat lectus in est risus auctor sed,898,2023-09-21T23:13:49Z,1
316,419,Message,quis orci eget orci vehicula condimentum curabitur in libero ut massa volutpat,428,2023-12-28T22:06:25Z,1
317,524,Story,fermentum justo nec condimentum neque sapien placerat ante nulla justo aliquam quis turpis eget elit sodales scelerisque mauris sit,878,2023-05-04T08:01:50Z,1
318,808,Story,donec semper sapien a libero nam dui proin leo odio porttitor id consequat in consequat ut,523,2024-01-21T21:42:16Z,1
319,479,Story,sed tincidunt eu felis fusce posuere felis sed lacus morbi sem mauris laoreet ut rhoncus aliquet pulvinar sed nisl,690,2023-04-07T02:31:05Z,1
320,982,Message,duis at velit eu est congue elementum in hac habitasse platea dictumst morbi vestibulum velit id,340,2023-08-08T11:36:21Z,1
321,363,Message,phasellus sit amet erat nulla tempus vivamus in felis eu sapien cursus vestibulum proin eu,486,2023-04-15T13:39:24Z,1
322,569,Story,dapibus nulla suscipit ligula in lacus curabitur at ipsum ac tellus semper interdum mauris,917,2023-05-04T10:51:31Z,1
323,680,Message,lorem vitae mattis nibh ligula nec sem duis aliquam convallis nunc proin at turpis,224,2023-06-22T10:01:29Z,1
324,101,Story,urna ut tellus nulla ut erat id mauris vulputate elementum nullam varius nulla,651,2023-08-21T10:16:50Z,1
325,448,Message,ultrices mattis odio donec vitae nisi nam ultrices libero non mattis pulvinar nulla pede ullamcorper augue a suscipit nulla,896,2023-12-08T17:21:46Z,1
326,390,Story,vitae mattis nibh ligula nec sem duis aliquam convallis nunc proin at turpis a pede posuere nonummy integer non,121,2023-09-28T16:54:47Z,1
327,690,Message,elit proin interdum mauris non ligula pellentesque ultrices phasellus id sapien in sapien iaculis congue vivamus metus,270,2023-05-03T12:48:57Z,1
328,39,Message,amet consectetuer adipiscing elit proin risus praesent lectus vestibulum quam sapien varius ut blandit non interdum,248,2023-10-18T05:13:43Z,1
329,480,Story,mattis odio donec vitae nisi nam ultrices libero non mattis pulvinar nulla pede ullamcorper augue a suscipit,851,2023-07-13T17:25:43Z,1
330,78,Message,rhoncus sed vestibulum sit amet cursus id turpis integer aliquet massa id lobortis convallis tortor risus dapibus,961,2023-08-01T00:34:08Z,1
331,482,Message,cubilia curae nulla dapibus dolor vel est donec odio justo sollicitudin ut,852,2023-07-18T14:25:26Z,1
332,449,Story,nullam sit amet turpis elementum ligula vehicula consequat morbi a ipsum integer a nibh in quis,527,2024-02-25T18:05:51Z,1
333,405,Message,id massa id nisl venenatis lacinia aenean sit amet justo morbi ut odio cras mi pede,134,2023-05-07T17:47:25Z,1
334,337,Message,et magnis dis parturient montes nascetur ridiculus mus etiam vel augue vestibulum rutrum rutrum neque,845,2023-10-15T08:55:56Z,1
335,241,Story,aliquam augue quam sollicitudin vitae consectetuer eget rutrum at lorem integer tincidunt ante vel ipsum praesent blandit lacinia erat,827,2023-04-08T22:04:05Z,1
336,784,Message,vestibulum proin eu mi nulla ac enim in tempor turpis nec euismod,786,2024-01-10T03:37:57Z,1
337,983,Message,sit amet diam in magna bibendum imperdiet nullam orci pede venenatis non sodales sed tincidunt eu,840,2023-10-23T10:22:52Z,1
338,973,Story,euismod scelerisque quam turpis adipiscing lorem vitae mattis nibh ligula nec sem duis aliquam convallis nunc proin at turpis a,584,2023-09-21T15:16:53Z,1
339,376,Story,pede posuere nonummy integer non velit donec diam neque vestibulum eget vulputate ut ultrices vel augue vestibulum ante,184,2023-05-24T01:15:41Z,1
340,375,Story,luctus et ultrices posuere cubilia curae nulla dapibus dolor vel est donec odio justo sollicitudin ut,824,2023-08-02T07:19:58Z,1
341,609,Story,aliquam convallis nunc proin at turpis a pede posuere nonummy integer non velit donec,461,2023-12-28T14:34:29Z,1
342,911,Story,cursus urna ut tellus nulla ut erat id mauris vulputate elementum nullam varius nulla facilisi cras non,721,2024-01-15T06:14:15Z,1
343,442,Message,tincidunt lacus at velit vivamus vel nulla eget eros elementum pellentesque quisque porta volutpat erat quisque erat eros viverra,919,2023-12-28T16:21:36Z,1
344,471,Story,id ligula suspendisse ornare consequat lectus in est risus auctor sed,19,2023-10-26T19:16:07Z,1
345,155,Story,luctus tincidunt nulla mollis molestie lorem quisque ut erat curabitur gravida nisi at,264,2024-02-20T22:47:46Z,1
346,138,Message,velit id pretium iaculis diam erat fermentum justo nec condimentum neque sapien placerat ante nulla justo,379,2023-02-24T01:35:56Z,1
347,143,Message,et magnis dis parturient montes nascetur ridiculus mus etiam vel augue vestibulum,261,2023-04-19T20:05:01Z,1
348,111,Story,lectus pellentesque at nulla suspendisse potenti cras in purus eu,895,2023-03-10T02:52:28Z,1
349,494,Message,commodo placerat praesent blandit nam nulla integer pede justo lacinia eget tincidunt eget tempus vel,676,2024-01-18T18:57:15Z,1
350,343,Message,non mi integer ac neque duis bibendum morbi non quam nec dui,801,2023-04-21T11:53:08Z,1
351,641,Message,bibendum imperdiet nullam orci pede venenatis non sodales sed tincidunt eu felis fusce posuere felis sed lacus,7,2023-05-17T14:51:11Z,1
352,48,Message,ut dolor morbi vel lectus in quam fringilla rhoncus mauris enim leo rhoncus sed vestibulum sit amet cursus id,700,2024-01-14T18:17:18Z,1
353,81,Story,non mauris morbi non lectus aliquam sit amet diam in magna bibendum imperdiet nullam orci pede venenatis,191,2023-05-27T18:25:52Z,1
354,142,Message,arcu sed augue aliquam erat volutpat in congue etiam justo etiam pretium iaculis justo in hac habitasse platea,368,2023-11-26T22:31:14Z,1
355,162,Story,nec nisi volutpat eleifend donec ut dolor morbi vel lectus in quam fringilla rhoncus mauris enim leo rhoncus sed vestibulum,841,2023-07-12T05:57:04Z,1
356,503,Message,leo odio condimentum id luctus nec molestie sed justo pellentesque viverra pede ac diam cras pellentesque volutpat,645,2023-04-06T03:23:01Z,1
357,802,Message,venenatis tristique fusce congue diam id ornare imperdiet sapien urna pretium nisl ut volutpat sapien arcu sed augue aliquam erat,362,2023-12-12T05:04:43Z,1
358,215,Story,faucibus cursus urna ut tellus nulla ut erat id mauris vulputate elementum nullam,283,2023-10-31T15:55:33Z,1
359,215,Message,venenatis non sodales sed tincidunt eu felis fusce posuere felis sed lacus morbi sem mauris laoreet ut rhoncus aliquet pulvinar,993,2023-12-18T08:19:47Z,1
360,285,Story,ligula vehicula consequat morbi a ipsum integer a nibh in quis justo maecenas rhoncus aliquam,512,2023-11-13T03:10:42Z,1
361,572,Message,diam in magna bibendum imperdiet nullam orci pede venenatis non sodales sed tincidunt eu felis fusce posuere felis sed lacus,84,2024-02-15T01:00:43Z,1
362,648,Message,consectetuer eget rutrum at lorem integer tincidunt ante vel ipsum praesent blandit lacinia,827,2023-12-01T02:48:43Z,1
363,54,Story,dictumst etiam faucibus cursus urna ut tellus nulla ut erat id mauris vulputate elementum nullam varius nulla facilisi,836,2023-04-22T12:56:40Z,1
364,431,Message,nisi vulputate nonummy maecenas tincidunt lacus at velit vivamus vel nulla eget,795,2023-06-16T12:43:05Z,1
365,261,Message,curae donec pharetra magna vestibulum aliquet ultrices erat tortor sollicitudin mi sit amet lobortis,369,2023-06-06T09:56:49Z,1
366,311,Message,condimentum neque sapien placerat ante nulla justo aliquam quis turpis eget elit sodales scelerisque mauris sit,853,2024-01-19T20:29:33Z,1
367,549,Story,ipsum praesent blandit lacinia erat vestibulum sed magna at nunc commodo placerat,300,2023-11-13T00:04:54Z,1
368,387,Story,consequat metus sapien ut nunc vestibulum ante ipsum primis in faucibus orci luctus et ultrices posuere,313,2023-10-28T06:42:50Z,1
369,196,Story,ut dolor morbi vel lectus in quam fringilla rhoncus mauris enim leo rhoncus sed vestibulum sit,332,2023-10-09T12:16:33Z,1
